Seller,Product,Price,Quality,Likes,Comments
zenithgifts,Canon 746 Ink Tri-Color,37.0,1,33,Canon 746 Ink Cartridge Tri-Color   Brand: Canon Black Ink - PG-745 > Ink Capacity: 8ml > Page Yield: Approximately 300 pages  > Compatible Models: iP2870 / iP2870S / iP2872 / MG2470 / MG2570 / MG2570S / MG2577S / MG2970 / MG3070 / MG3070S / MG3077S / MX497 / TS207 / TS307 / TS3170 / TS3170S / TS317
zenithgifts,HP 2130 Deskjet All In One Printer,74.0,1,86,"Brand New HP DeskJet 2130 All-in-One Printer  Print, scan, and copy what you need quickly with a reliable all-in-one.  Get started in fewer steps. Easily set up this all-in-one to print, scan, and copy with simple controls.  Check off your to-do list without writing a big check. Print, scan, and cop"
yeezywill810,Apple Airpods gen 1,100.0,0,37,Light used airpods very clean too tryna let go fast bought it this january so around 7 months warranty no box and wire included i can provide u with serial number for verification.Price is negotiable so please message.Able to deliver to doorstep islandwide too stay safe at home during the pandemic😀😀
minecraftplug,Airpods Gen 1,70.0,0,19,Selling these airpods as they are quite dirty hence the low price.  Comes with box + receipt from challenger if you would like. Payment by paylah price is non nego Caroupay accepted too
freepursuit,REDUCED! Handheld Game Console,25.0,1,1,"Take that mobile phone away, and give your little one the gift of your childhood with this retro game console containing 500 games! This black console carries a 3-inch LCD screen and a 800mAh lithium-ion battery, charged via a mini USB cable. Comes with an AV Cable too. The console measures about 7."
elegancestudios,SketchUpPR0 2020,19.0,1,1,Computer Parts & Accessories
zenithgifts,HP 680 Ink Cartridge,46.0,1,26,"HP 680 Ink Cartridge - Color + Black  Hardware Compatibility:  HP DeskJet 1110, HP DeskJet 1115, HP DeskJet 2135, HP DeskJet 3630, HP ENVY 4520, HP OfficeJet 3830, HP OfficeJet 4650  Package dimension (WxDxH): 4.53 x 5.63 x 1.42 in  Do visit our other listings👏🏻  Tags: black, ink, cartridge, office,"
akgadgets,11 : AMBIANO 34L Electric Convection Oven With Twin Hot Plates & Rotisserie,65.0,1,35,"There is always room for one more in the kitchen, especially a handy one like this convection oven. Once you have one of these electric ovens at your fingertips, you will understand how convenient it is: it heats up faster then a large oven and there is less to clean, it is great for cooking meals o"
ctapl,"Brand New - Lenovo IdeaPad5 14IIL(81YH007ASB)14.0"" FHD IPS 300nits /i7-1065G7/16GB Ram/ 512GB PCIE SSD",1549.0,1,9,"   Specs :        >>>>> 2 Years On-Site Warranty Under By LENOVO<<<<<  * Processor :  Intel® Core™ i7-1065G7 (3.9GHz) * Operating System : Windows 10 Home 64Bit * Memory: 16GB DDR4-3200MHz * Storage: 512GB PCIe SSD * Graphics : NVIDIA® GeForce MX350 DDR5 2GB * Display : 14"" FHD IPS(1920 x 1080), ant"
zenithgifts,Toshiba 1 TB Harddisk,78.0,1,16,"toshiba 1tb canvio advance   toshiba 1tb hd/hdd  👉 Interface USB 3.0 (USB 2.0 compatible)  👉 System requirements Formatted NTFS for Microsoft®️ Windows®️ 10, Windows®️ 8.1, Windows®️ 7; One free port of USB 3.0 or USB 2.0 Requires reformatting for macOS v10.15/v10.14 /v10.13 /v10.12/v10.11/10.10  👉 "
mranwar729,Mac book 2017,800.0,0,7,Look like new. Come with box only. Space on Picture.
zenithgifts,HP 60 Ink Cartridge,34.0,1,8,"hp 60 ink cartridge tri color  👉 ~165 pages  👉 Hardware compatibility: - HP Deskjet D1660/D2560/D2566/D2660/D2666/D5560 - HP Deskjet F2410/F2476/F2480/F4230/F4250/F4280/F4480 - HP PhotoSmart C4680/C4780 - HP Envy 100/110/120   Printers, HP Deskjet D2530 Printers, HP DeskJet F4200 All-in-One  🎉 Buyin"
ingfatt,Krell cd player,4000.0,0,25,New 12.5 k.  With box and receipt  Now 4 years plus old Mint condition. Extra set Remote control battery leaked due to non used
brstix,Palit geforce gtx 1060 3gb,120.0,0,4,"Lightly used for about 3years.
 
 Everything working fine. Currently installed in my system. Will remove once pending deal.
 
 Played mainly cs:go on it. No mining done.
 
 Looking to trade up to a 1070 therefore selling.
 
 Full box, anti static bag and CD.
 
 Unboxing: https://www.youtube.com/watc"
clementchen72,MacBook Pro 13-inch 2016,1300.0,0,40,"Specs ——— MacBook Pro (13-inch, 2016, Two Thunderbolt 3 ports) No Touch Bar Space Grey 2 GHz Dual-Core Intel Core i5 RAM: 8 GB 1867 MHz LPDDR3 GRAPHICS: Intel Iris Graphics 540 1536 MB STORAGE: 256GB SSD  Others ———— Condition: Excellent  No scratches no dent Battery Cycle Count: 19 Box: Yes Charger"
garytheh,BNIB Sonos set for sale,2100.0,1,11,"BNIB Sonos set, 2 X Sonos One voice command ready, 1 X Sub Woofer, 1 X Sonos Beam. Bought it July  last year did not have chance to set up. invoice still with me. All item had never unbox before, original seal intact. Original price paid $2,506 for whole set"
sniper5,Lenovo Laptops,300.0,0,40,X250-$300 T450s-$400 (Sold) T460s-$500 T470s-$800 Under warranty by manufacturer  T480s-$1200 Under warranty by manufacturer  P51s-$1500-Under warranty by manufacturer  P52-$2000-Under warranty by manufacturer   Carbon X1 2nd gen-$400 Carbon X1 3rd gen-$600 Carbon X1 4th gen-$800  http://www.thinkwi
exquisite_collections,Owell Rock n Roll 4D Massager,250.0,1,1,Brand new with box. Never use as received as gift. COD collection near Clementi Mrt. Postal 120429.
yjwong,PowerColor Radeon R7 360 2GB GDDR5,55.0,0,10,"Entry level GPU, decent for light gaming.  I have replaced the thermal paste. Selling because upgraded to RX 580."
iluveggs,The Lion King handheld fan,12.0,1,5,the lion king original handheld fan from the Singapore Zoo 100% unopened and new  retail price : $24
gamingspecialist,13D 5743 (NEW) Palit GeForce GTX 1080 Ti 11GB Boost Graphics Card,780.0,1,34,"The GeForce® GTX 1080 Ti is NVIDIA’s new flagship gaming GPU, based on the NVIDIA Pascal™ architecture. The latest addition to the ultimate gaming platform, this card is packed with extreme gaming horsepower, next-gen 11 Gbps GDDR5X memory, and a massive 11 GB frame buffer.  Palit NEB108T019LC-1021F"
raysqkoo,Panasonic aircon remote control,10.0,0,3,Great condition
joeyjoe26,Campfire Audio Andromeda S iem ciem ,1300.0,0,90,"- very lightly used  - look at actual pics for condition  - comes with iem, black hard case, stock litz cable, some stock tips, brand new spinfit tips  - limited edition run, not available anymore, only 2000 pieces in the world  https://campfireaudio.com/shop/andromeda-s/  Andromeda is still one of "
cf.18,Bose Acoustimass 5 with Yamaha Amplifier,180.0,0,12,"Bose Acoustimass 5 Series II speaker system. All speakers working and can get very loud, tested with the wires I had at home.  Yamaha RX-V350 Amplifier. Working well as well. Has many options and controls. Dolby DTS surround capable and Pro Logic II.   Got this set from a friend and I don't want thi"
cluwy,Musical Fidelity X-Can V3 for sale,120.0,0,6,"Priced to sell. In good working condition. Please note that exterior of the headphone jack has rusted, refer to third photo. "
ky_wee,"Outdoor Security Camera, Wansview 1080P Wireless WiFi Home Surveillance Waterproof Camera with Night Vision, Motion Detection, Remote Access, Compatible with Alexa-W4",30.0,1,5,Features & details  【1080P FHD with 2 Megapixel Lens】Wansview outdoor security camera is equiped with 2 Megapixel HD lens which delivers crystal clear & smooth video day & night protect your home wherever you are Camera works with 2 4G WiFi（5G is not supported）  【Works with Alexa & Night Vision】Wans
nimran20,"Apple Macbook Pro(15 inch, 2019) for sale",2500.0,0,27,"Apple MacBook pro 2019 model for sale. Its used very less. Price is negotiable. Warranty available till Sep 21, 2020  Not even a single scratch. Comes with Box and other accessories which i got in box.   My loss your gain.  Note : Planning to change to Android"
singaporechannel,"Grabfood delivery Foodpanda Deliveryroo Delivery 26""  Fixie With Coaster Brakes New Bicycle instocks",168.0,1,4,Brand New Limited Stock!   💓 Click For More Pictures 💓 ➡️https://sg.carousell.com/p/260469861  - Whole bicycle - Free assembly of bike - Comes with free maintenance tools - Delivery to doorstep (+$30)  For Self collection or viewing at (LiftLobby) Blk 413 Yishun Ring Road Ave 11 S(760413) Do let me 
premium.affordable,PODOOR USB Type C to HDMI Adapter Cable 4K,15.0,1,1,"•	♬ STABLE TRANSMISSION: Supporting up to 4k thanks to its unique premium flash chips and is also backward compatible with 1080P and 720P. (Note: For iPad Pro 2018, video resolution up to 2560 x 1440 due to the iPad Pro 2018 uses the DisplayPort protocol to support connections)  •	♬ PLUG AND PLAY: N"
excelnword.pc,G4400 desktop cpu / 1060 / Gaming Custom PC Gaming Gaming Custom PC PC Desktop  Custom Desktop Custom PC Gaming PC Desktop Desktop Gaming Desktop Desktop Custom Desktop Custom Custom PC Custom Gaming PC Custom Gaming Gaming Desktop PC Desktop PC Gaming,288.0,1,73,"This is our entry level gaming PC, that can handle many games at 1080p, 60FPS, With GTX 1060 level performance for only $350!?!?!?! this is a freakin steal   Basic Budget Gaming Rig  Intel G4400 @ 3.4GHz NVIDIA P106-100 (GTX 1060 equivalent) 8GB RAM 64GB SSD + 500GB HDD Windows 10 Pro  $350   Able t"
gamingspecialist,"5A 6385 (NEW) SUNAVO Hot Plate for Cooking, Electric Hob Portable, Hotplate Cooktop Single Burner 1500W Silver",35.99,1,9,"💬 CHAT TO BUY WHEN YOU HAVE DECIDED ON PURCHASE.  -SELF COLLECTION/ REGISTERED DELIVERY ONLY. (Please arrange with us before coming, as item might not be available.)  ✅ Please kindly read through the description of product given. (Items are exact to picture listed, unless otherwise stated)   PS. I w"
yong.kelvn,industrial exhaust fan,50.0,0,4,In good condition.
dragonflyme13,Gravity Feed Air Spray Gun Orazio H-827,50.0,1,5,"CARTMAN HVLP Gravity Feed Air Spray Gun H-827, H-827P, 20.2 oz Capacity, 2.5-3.5 CFM (Cubic feet per Minute), Optimal Working Pressure 3.0bar/43psi, Nozzle Size:1.4mm with Air Regulator  Brand new in box from amazon UK. You may check out specs and pricing on the website before purchase.  Pre tested "
dramafreeseller,iBoutique ColourJets 3rd Generation Wireless Bluetooth Rechargeable Dancing Fountain Speaker,58.0,1,1,"Don't just hear your music, see your music  Introducing the Dancing Water Speaker brand - iBoutique ColourJETS  If you are looking for a something a little different - perhaps for a gift or a party, these are ideal. What are they? Essentially you receive a set of speakers that connect to any 3.5 mm "
tiffany018,ANKER USB C Wall Charger 1PD + 4PIQ - UK Adapter [A2056],45.0,1,2,"The Anker Advantage: Join the 20 million+ powered by our leading technology. Revolutionary Speed: Charge any USB-C device at top speeds with the Power Delivery port (MacBook charges at 30W), while 4 PowerIQ ports intelligently recognize your device to boost charging speeds up to 2.4A per port. Five-"
localsgstore,(46) QUINEAR Foot Massager,89.0,1,5,"Features & details IMPROVE CIRCULATION AND RELIEVE TIREDNESS - The QUINEAR Foot Massager Has Two Kneading Speeds, Two Heat Levels, Two Auto Modes Optional.Suitable For Different People To Use. Whoever You Are Standing All Day, Sitting In Front Of The Computer Or Poor Circulation, You Can Use This fo"
laptop.factoryoutlet,"Celebrating end of ""Circuit Breaker""! PROMO CODES [LT]",0.0,0,1,"🥳Celebrating end of ""Circuit breaker"" 🎉  😆Counting down 17 days to FREEDOM‼️ ‼️We are giving out EXCLUSIVE promo codes for our online store‼️  Check out the promo codes down below!  Click here to view Samsung Flagships 👉 https://laptopfactoryoutlet.com.sg/product-category/mobiles/samsung/  Click her"
laserlinecases,MacBook Pro 2015 13 inch,999.0,0,9,Full Box set.  9.9/10 Condition. Well taken care of. No scratches or dents.  Have those USB ports.  Sanitized and thoroughly cleaned before transaction.   Comes with: Speck Hardshell Case ($70) Moshi Palmguard ($25) Camera Protector slidey thing ($2)
maxq70,Inkjet printer HP 6520,85.0,0,5,used HP printer loaded with new original cartridges (x4). still in very good working condition.
xtremesolution,Steelseries Neon rider edition - PRE-ORDER,29.0,1,9, Interested customer are to PM us now inbox for the pre - order.  Steelseries QcK L Neon Rider Edition  Steelseries QcK Prism XL Neon Rider  Steelseries Sensei Ten Neon Rider Edition
sell1994,SAMSUNG SHP-DH525 BLUETOOTH DIGITAL DOOR LOCK,510.0,1,12,"WITH FREE DELIVERY , FREE INSTALLATION BLUETOOTH PUSH & PULL DOOR LOCK  UNLOCK ACCESS METHODS : Smartphone App, RFID Card, Number Pad, Mechanical Key Warranty : 2 years warranty (1st year full, 2nd year only on parts) "
contraled2,Apple imac ddr4 ram 2x4gb,50.0,0,8,"Taken out from imac 27” ddr4 ram, total 8gb. PM to deal. "
ddaarren,Sonos Playbar,699.0,0,17,3 year old soundbar in excellent condition. Box will be included.  No more warranty.  I can deliver the product to you from 10 June onwards only as I have pre-ordered the Sonos Arc.  Slightly negotiable if self-collect. Please offer.
skylelong,Claoner Dash Cam 1080P Full HD Dashcam Car Camera,35.0,1,3,"✦【FULL HD 1080P & 3 inch IPS Screen】Simultaneous recording with super high-resolution 1920X1080P FHD 60fps lens deliver clearer videos&images. Not only that, 3"" IPS technology allows you to view a clearer video you need directly on the dash cam and replay the key moment even when high-speed driving."
sgprimeauction,C369. REYTID Beats by Dr. Dre DUDE Pill Speaker Holder Stand/Case - White - Character Wireless Bluetooth Speaker Cover,20.0,1,2,Customisable Beats Pill DUDE Speaker Holder. Matte WHITE finish - can be drawn on or painted to customise to your taste. Beats Pill speaker will snap into place with ease and allow full access to all the cables & button functions. Beats Pill is NOT included. PLEASE NOTE:- This is NOT an official Bea
rebecca13chen,Huawei Bluetooth Speaker,15.0,1,1,"Main Features: • Bluetooth version: V4.2 • Material: plastic • Support agreement: A2DPV1.2, AVRCPV1.4, HSPV1.2, HFP1.6 • Transmission distance: 10 meters • Speaker impedance: 4 ohms • Speaker unit: 40mm • Whether to support TF card: yes • Maximum expansion capacity: 32GB • Frequency response: 2.402 "
sgpropertytop.com,Popsical remix preorder April collection 1 year warrently,399.0,1,39,April collection at orchard plaza 05-32 /33 sms to 83239955 to preorder
dyeyz,Nomad Base Station (Apple Watch Edition),60.0,0,14,Only 1 out of 3 coils is working. The working coil is the one on the right.  Apple Watch charger works fine with no issues.  No box No warranty
ben1302,Yeelight LED Strip (export set),40.0,1,1,Light colours can be adjusted. Link it to ur Google home!
sh_hyperstore,Inlins Ice Cool IPL Hair Removal  (Z750),50.0,1,4,"🍄【Painless ICE Feeling Function】Deparee hair removal machine attaches ice compress function which can calm down the skin, relieve redness and swelling. Simply turn on the ice cool mode, you can enjoy doing hair removal and cooling care at the same time. It is exactly the painless and comfortable tre"
hifine16,"sony 14 inch, GEN3  i3-3120M, 8GB+500GB, WIN10",186.0,0,19,"sony 14 inch, GEN3  i3-3120M, 8GB+500GB, WIN10,DVDRW, work fine, battery faulty,functioning well plug in powe, right back corner cracked, but not affect usage, with charger"
abi-gail,IMAC,100.0,0,10,IMAC 2007. it works but the issue is the LCD screen has issues. Due to lot of wiping something happened to the screen. If someone knows how to fix it then it would be useful. The CPU still works- can switch on.
chen.electronics,"EasySMX Wireless Game Controller, 2.4G Wireless Game Controller, Best Christmas Gift, Dual Shock, TURBO for Android Phone or Tablet with OTG Function & PS3/PC/TV or TV Box",48.0,1,1,"Features & details  🎮【Get a free Gaming Mouse when you purchase £30.00, Code：DTHLQZJH 】 【Stable Signal】EasySMX Game Controller adopts 2.4 wireless transmission technology, plug and play. No delay or signal interference, offering you premium and real time experience. 7m (23ft)-range allows you to pla"
desktopdiy,Deepcool Dual Fan CPU Fan /Cpu cooler /LGA 1150/1151 /1155/AMD,18.0,1,2,brand new sealed
eh_movers,Tool kit bag,12.0,1,2,interested pls call hp 97403113
mrlobangkia,JBL GO2 Portable Bluetooth Speaker,30.0,1,28,"💕💕 Free shipping with Standard EXPRESS Delivery to your doorstep alongside fast dispatch ! 💕💕  This is a Wholesale listing , traceable payment can be done by Paynow, Paylah or Bank Transfer.  ETA 3 to 5 working days  -----------------------------------------------------------------------------------"
sqweak,Graphics cards,0.0,0,21,1.HIS Radeon HD 6770 -$30 Power: 1x6-pin Comes with driver disc.  2. Gigabyte GT 430-$20 Power: PCIe lane only Low profile card  3. Palit GTX 560Ti -$40 Power: 2x6-pin  4. MSI Radeon R9 390X Gaming 8G-$100 Power:6+8pin  Pic 2 5. ATi Radeon HD 2600 Pro-$10 Power:PCIe only  6. MSI RX Vega 64-$330 Powe
andigitallock8888888,Digital fingerprints locks +gate bundle,1388.0,1,1,Digital Fingerprints Door +Gate lock +Customize Gate!!  Sick for your old gate?? Time to Change a new look !!! We have great deal at a unbelievable price!! 😉👍  For more enquiries free to contact (Serene @81617614 An digital Lock)  ***Suprise gift @worth $129 will be given!!
hbay2011,Remington Shine Therapy Curling Wand,20.0,0,2,Used once only. Good as new. Price is negotiable 
contraled2,AKG Q701 Reference Series Headphones,250.0,0,2,"If you are an audiophile, you already know how good this is. Headphone stand not included. PM to discuss. "
mesh23,Sonos Play Bar,630.0,0,14,Selling my used Sonos Play Bar.  Still in great condition.    There’s no warranty.  I do not have the box either. 
esurferzone,Ubox UproS - free delivery island wide,170.0,1,42,Get the latest Unblock Ubox ProS Gen 7.  Technical Spec as follow: System Android 7.0  RAM 2GB / ROM 32GB  Dual WiFi 2.4G + 5G  USB Interface consist of USB 1X USB 2.0 + 1X USB 3.0 for faster access to connected devices  HDMI Output Support HDMI 2.0 4 K @ 60 fps  Brand new chip supports all 4k film 
fluffehlicious,"FLC8S Hybrid IEM (1Dynamic, 2BA, Tunable)",260.0,0,26,"PRICE DROP -- Lowest I'll go.  UPDATE: Bought and installed KZ's 8-strand SPC. Sounds better than ever (and doesn't tangle). Same price - this is excellent value.  Pair of FLC8S Hybrid IEMs (1DD, 2BA) with filter system to tweak the sound signature to your preference.  Doesn't need much introduction"
newchapters.,Liquor Wine Whiskey Cooking Olive Oil Bottle Pourer Stopper! For Parties And Events!,8.0,1,55,"Be a professional bartender, chef or to impress your friends and family!  Metal Type Stainless Steel Eco-Friendly Certification CE / EU Metal Type Stainless Steel Diameter <5cm "
newchapters.,Multipurpose Magnifying Glass! Jewelry Loupe! 20x and 30x! For Watch and diamond!,10.0,1,56,"View everything and anything! From small microchip, diamonds, stamp and many more!  -$10 without box! -$12 is 30x! -$2 more With Casing Box!   Mini Jeweler Loupe 20 x 21mm Eye Magnifying Glass Magnifier with Case  Great product for the watch making industry, specially for inspecting those tiny objec"
jadesound,ESS Classic Pedestal Speaker,519.0,0,19,Excellent sweet warm sounding floor stander. This ESS using double 8ins woofer. And an outstanding superd Heil Air Motion transformer tweeter.  Cabinet is fair but still ok . All driver work. Very sweet warm open sounding speaker. Very good for those playing tube amp. At only $519.
cashconverterssg,SMART LED FLOOD LIGHT 2 PCS PACK,29.0,1,2,"SKU-6800000070470
 BUY THIS ITEM AT OUR WEBSITE ; https://www.cashconverters.sg AND USE VOUCHER CODE : CB10OFF TO GET 10% DISCOUNT WITH NO MINIMUM SPENDING REQUIRED.
 
 URL-https://www.cashconverters.sg/smart-led-flood-light-2-pcs-pack-6800000070470.html"
larrymutt,Sonos Play 1,180.0,0,6,Audio
newchapters.,Spy Camera Recorder HD Night Vision! Monitor Everything!,15.0,1,65,"Perfect for surveillance for your baby, kids when you at work! Protect your house, home and office!  Feature: - High definition full HD1080P - Support 32GB TF card max. (Memory card not included) - Image proportion: 4 : 3 - Support system: Windows ME / 2000 / XP / 2003 / Vista, Mac OS, Linux - Batte"
newchapters.,16 in 1 Screwdriver Tool Set! Magnetic Tip! For Mobile Phone and Laptop Repair!,10.0,1,60,"A must have tool set kit for Engineer, DIY, Handphone repair, IPhone, laptop repair, watches!  Package list: 1 x Screwdriver head 15 x insert bits Comfortable rubber 8.5cm length hand grip removing cell phone case, cover, antenna, electronic board etc Magnetic rivet tip Torx: T5, T6, T8, T10, T15 Cr"
shere225,Anne pro 2 keyboard very new - brown kalih,70.0,0,3,"Lightly used less than 1 month, as shown on order. Come w USB c cable / swappable keycaps.  Used on macbook pro lightly."
techdealssg,"Canon PIXMA MG2570S Wired USB Print, Scan, Copy",59.0,1,5,"Compact All-In-One for Low-Cost Printing. Affordable All-In-One printer with basic printing, copying and scanning functions.  Print, Scan, Copy ISO standard Print Speed (A4): up to 8.0ipm black / 4.0ipm colour Hi-Speed USB 2.0 Recommended Print Volume: 10 - 80 pages Included ink cartridge: 745s Blac"
rabsgstore,Neporal Portable LED Work Light Solar and USB Rechargeable with 2 Brightness Modes 360°Adjustable Flashlight Solar Camping Lights 550mAh 50lm Rechargeable Night Light For Household Camping Hiking Car,10.0,1,7,"G11  ★【Recharge Anywhere】No More Darkness Emergency. This adjustable work light is rechargeable by solar or 5V AC adaptor. You can put it in car, tent, balcony, backpack, and it will get charged without any cost! ★【Fit In Anywhere】This solar light is 360°adjustable and light. It will easily fit in y"
tluckhomecare,Hair Clipper,15.9,1,24,Hair clipper $15.90 (Yishun 91682045 ) (Woodland 88111755) (Hougang 91120818 )what’s app for more info . Same day delivery if order before 4:30pm for the above 3 location. Delivery $3. Above $50 free transport . Minimum order $10. Check out all our listed products.
newchapters.,"USB Webcam For Laptop, Desktop and Mac! Retractable And Easy to Use!",14.0,1,6,"Ideal for video conference, school teaching and gaming!  Description: Feature: Designed for both laptop and desktop. Built-in microphone, plug and play. High definition and true color images. 360 degrees rotary function, all angle is available. Compatible with USB2.0/1.1. Auto exposing control. Auto"
newchapters.,Aluminum Metal Wallet Card Case! Anti Theft Blocking RFID! Stylish and Fashionable!,10.0,1,5,"Can slot in many credit cards and ez link! Stylish and Fashionable! Compact! Sturdy and Anti RFID!  Feature: Wallet Credit Card Holder RFID Blocking Hard-shell case also blocks radio frequency tags (protects RFID chips in credit cards) for added ID theft protection. Seven-pocket, accordion-fold inte"
techdealssg,Canon PIXMA MG3070S Compact Wireless All-In-One with Low-Cost Cartridges,85.0,1,3,"Affordable Wireless All-In-One that comes with cloud and mobile printing solutions.  Print, Scan, Copy ISO Standard print speed (A4): up to 8.0 ipm black / 4.0 ipm colour Hi-speed USB 2.0, Wireless, Wireless PictBridge, Direct Wireless Recommended print volume: 10 - 80 pages"
itsmine.pc,"CORSAIR HS45 SURROUND Gaming Headset, Carbon  CS-CA-9011220-AP",79.0,1,8,"Brand New In Box  Official Local Distributor warranty    No Trades Price Non Negotiable Delivery Charge - S$10.     STORE PICK UP AT:   PM for store location  Open daily  Mon-Sat 12pm-8pm Sun, PH 1pm-6pm  "
newchapters.,Wireless Speakers With LED Lights! Stylish and Sleek!,8.0,1,7,Bring it to your parties and dinner! Impress your friends and families with this stylish Bluetooth speaker!   2 sizes: Small: $8 Medium: $10  Support TF card with Microphone for Smart Phone PC Tablet!  Product description Specifications :  ★ Battery: Built-in rechargeable 110mah lithium battery ★ di
avntcn,Sonos Play 1,190.0,0,3,"Black, in perfect working condition. One small dent in the front. Doesn't come with box/original packaging"
linguam,Dell Docking Station d6000,350.0,1,1,bnib.  open to test workability able to charge up to 65w thru USB c  Universal Docking Solution  Conveniently connect any laptop equipped with USB-C or USB3.0 with the Dell Universal Dock - D6000. Enjoy universal compatibility with a wide range of PC brands and operating systems supported by Display
woodles,Cordless Foldable Portable Standing Fan USB Rechargeable Height-Adjusted Floor Desk Table*Ready Stocks Ship from SG*FREE Gift*,34.9,1,67,Greetings from Woodles Home & Living!  All our Products are Shipped Directly from Singapore. Enjoy Fast Shipping and Excellent Customer Service from Woodles Today!  This product is now available at:  Lazada - https://www.lazada.sg/-i647918826-s1955434391.html?spm=a2o7e.10603407.new-navigation.22.7ec
bloberme,"24V 5Amp Automatic Battery Charger Maintainer, Car Battery Charger Maintainer with Alligator Clips for Scooter, Wheelchair, Motorcycle, eBike, Lawn Mower Electric Tools Emergency Light etc",42.0,1,5,"【""TPE"" SPECIFICATIONS 】: Input Voltage: 100-240Vac@50/60Hz; Maximum charging current: 5A; Charger Output Amperage: 5A; Charging Battery (Ah): 15-100Ah,We are the only genuine seller of this product. In order to maintain market order and your purchasing experience, please look for the trademark: TPE."
papabless.,MacBook Pro 15 inch i7 32GB Ram,4000.0,0,18,Helping my mum sell off her MacBook Pro 15 inch 2018 edition.  Laptop was won in a lucky draw and is worth $4.8k with the current specifications. Please note that this is the 32GB ram upgrade with 500GB flash storage.  Specs: I7 32GB Ram 500GB HDD Apple care + until 2022 Will throw in an incase carr
