Seller,Product,Price,Quality,Likes,Comments
rabsgstore,AP-02 Guitar Pedal Power Supply Guitar Accessories 8 DC Outputs for 9V / 12V / 18V Effect Pedal Power Station Cards Box SG Plug,28.0,1,17,"F513  This universal power pedal supplu probides 8 negative center barrel taken with a total power of 2000mA. Sockets of A and B are switchable to 9, 12 or 18 volts to power effects that require higher DC cuttents or 9 volt pedals which can be operated on 12 or 18 volts for the most dynamic and head"
kreative.electronics888,AB210 Micro Guitar 5W Amplifier,30.0,1,2,"Features:  5W power amplifier.  Excellent performance & elegant design.  Adopts high-sensitivity dedicated guitar speaker.  Sound is clear and clean, with excellent sound effects.  Equiped with the volume & the tone controlling functions.  With an input port and a headphone port.  Compact, reliable "
mansacomputers,Asus GTX 1660 6 GB Phoenix,250.0,1,96,Brand new in box. Comes with 3 years warranty.
loh.dorothy,Qnap TS-869 Pro,750.0,0,14,- 8 bay tower TurboNAS - CPU 2.13G dual core - memory 1G RAM  - HDD not included  - available 5x 2TB SATA HDD @$80 each
tadonalizambrose,Sewing Machine for sale.$80.good condition.hp 81208559,80.0,0,3,sewing machine for sale.$80.good condition.hp 81208559
acc3ssori3s,JBL Flip 5 Portable Waterproof Speaker *Local Sealed Set with Warranty*,115.0,1,15,BNIB Sealed with one year SG warranty by JBL receipt will be provided  Price is firm  Color : Blue / Black !  Sounds better than ever Bring the party anywhere Make a splash with IPX7 waterproof design Crank up the fun with PartyBoost A rainbow of colours Tough as it sounds
amorezel,"Record Player, Portable Mini Suitcase Turntable for 7 Inch Vinyl Record, Belt-Drive 2-Speed Turntable with Built in Stereo Speaker (Blue)",30.0,1,7,Mini & Cute Turntable  Portable Mini Record Player --The Smallest Suitcase Turntable in the World  About Music Public Kingdom  Our record player is a perfect combo of trendy elements and retro style with classical color series. With rich experience of 20 years in turntable industry. Our record playe
homemade.with.love,Thermomix TM5 ( We accept instalment plan by credit card),1500.0,0,102,"$1500 negotiable   We accept instalment plan by credit card  95% conditions is like brand new set  I have 2 thermomix for sell  Both are TM5 - Original price $2320 Use few time  WhatsApp me if you are keen  Pls don’t pm me due to rarely online   Complete come with Basic Cookbook & Cook chip, TM acce"
hotcpu,Lenovo Laptop for sell $100,100.0,0,41,Sell Lenovo ThinkPad laptop Can used for office  Homework  Youtube   Win 7 os Cpu: T8100 core 2.    2.1GHZ Ram:2GB HDD:120 GB 14 inch Monitor  Win7 os With charger  Let me know if you want  Thanks . 
kessfoo,AirPod BOX only (original),2.0,1,1,Box only  Additional for postage
ong7710,Taotronics soundsurge 60,33.0,1,5,Audio
ptm108,Ryzen 5 1600 AF,170.0,0,14,"Selling an Ryzen 5 1600 AF. Used for less than a month, recently upgraded. Comes with box, manual, CPU cooler. 6 cores 12 threads, sufficient for most workloads.  Do note this is the AF version (check the serial number on box). Similar performance and architecture to the Ryzen 5 2600. Google for mor"
rabsgstore,ammoon 61 Key Roll Up Piano Electronic Keyboard Portable Silicon Built-in Stereo Speaker 1000mA Li-ion Battery Support MIDI OUT Microphone Audio Input functions (61-Key),50.0,1,7,"G6x2  Portable 61 keys roll up piano with LED display, silicon material, comfortable to play and convenient to carry. 128 kinds of tone that can be chose by numbers keys, plus 128 kinds of rhythms and 14 demo songs, various choices for you. Built-in speaker, you can enjoy the music freely; with 3.5m"
supersgsell,"LED Strip Lights, HRDJ Light Strip RGB 32.8FT/10M 20Key, Music Sync Color Changing, Rope Light 600 SMD 3528 LED, IR Remote Controller Flexible Strip for Home Party Bedroom DIY Party Indoor (2x5m)",50.0,1,6,"** Colourful LED lights , can control to have 3 colours at the same time  ♛【Amazing Dancing HRDJ Light】With a high keen mic, this light strip can listen and dance to surrounding music. You will see it flashing and changing color with beats! If you love music, this is a must try decoration for you.  "
game.onz,GAMEMAX GAMMA 300 RAINBOW CPU COOLER HSF HEAT SINK TOP FLOW INTEL AMD COMPATIBLE LGA 115X 1366 775 AM4 AM3 COMPONENT,40.0,1,10,"AUTHORISED DEALER, BRAND NEW, LOCAL WARRANTY  http://www.gamemaxpc.com/productkkk/showproduct.php?id=939  Gamma 300 Rainbow Gamma 300 CPU air cooler provides excellent performance featuring a 120mm big bowl fan for higher air pressure, and unique top-down Accelerated Cooling design to dissipate heat"
trivalc,Xiaomi Smartmi Fan with Built-in Battery Smart APP Controls and Oscillation Mode / Xiaomi Smartmi Pedestal Fan / Xiaomi Fan / Xiaomi,129.0,1,16,"Refer to this video for more information:  https://youtu.be/MsjPNjAIrKs  Main Features: • Simulates Comfortable Natural Wind • Quiet Operation less than 31.5dB • Lightweight and Portable • 100 Stepless Speeds • Smart APP Controls • 2800mAh Lithium-ion Battery, up to 20 hours of refreshing breezes  T"
tech22,👍2020 New Svicloud Android Tv Box,148.0,1,52,⭐3 DAYS RISK FREE RETURN IF YOU ARE NOT SATISFIED WITH QUALITY OF TV BOX BUT YOU HAVE TO PACK IT BACK NICELY INTO THE BOX.  ⭐EASY INTERFACE FOR ELDERLY  ⭐1000+ LIVE CHANNELS   ⭐10000+ VODs   ⭐LIVE 🥊🏀⚽️  ⭐LOCAL VERSION WITH MALAYSIA LIVE AND MALAYSIA VOD   ⭐1 YEAR OFFICIAL WARRANTY WITH WARRANTY CARD
fossil.hub,[FREE delivery & Promotion] Marshall Major II On-Ear Headphones with Mic Headset,79.2,1,229,"Marshall Major II On-Ear Headphones with Mic Headset  ** IMMEDIATE STOCK, no need to pre-order. While stocks last! **  💯 ASSURED with your purchase. Legit seller with 50+ positive feedbacks and proven sales   👍 WIRED headphones, Item is brand new, original and authentic straight from Marshall Distri"
rabsgstore,Torch Clip Mount Bicycle Front Light Bracket Flashlight Holder 360°Rotation Black,3.0,1,11,Material: High quality Aluminium Hold the flashlight or torch on your bicycle With antiskid rubber gaskets to protect your handlebar from wear and tear Suitable for the diameter of flashlight 1.6-3.6cm Suitable for the diameter of handlebar about 1.6 x 2.8 cm  High quality rubber with metal screws E
yharnamite,Mini ItX gaming pc,1.0,0,29,"I’m leaving SGP so hope to sell fast Spec: https://valid.x86.fr/xt8nck Please offer. Do note with or without monitor. Note:  Monitor with built in speaker. i7 7700k delidded so it runs pretty cool, paired with Cryorig C7 hs. Asus ROG Strix 1080Ti OC. 2 SSD (1TB+256Gig) + 1TB HDD. Chassis is silver s"
bubblycheska,Philips Micro Music System BTD1180,100.0,0,20,"Philips Micro Sound System  Lightly used in Good Condition Comes with Original box. Self collect at Serangoon North Ave 4  Sound that fits your home Listen to all your digital music from your Smartphone via Bluetooth®. The Philips sound system also plays DVDs, DivX titles, CDs and MP3-CDs. Enjoy you"
williamshz,Emotiva : BasX -A150 Stereo Power Amplifier,395.0,1,23,New set. Played once or twice for testing. Perfect condition. No scratches no dust.
diine,1441) FUGEN 60W AC Adapter Charger for Apple Macbook Air A1184/A1330/A1344/Retina A1435/A1435/A1502/A1425 (White),18.0,1,2,Brand new with box  What you see is what you will get  FUGEN 60W AC Adapter Charger for Apple Macbook Air A1184/A1330/A1344/Retina A1435/A1435/A1502/A1425 (White)  Description  It's a 60w adapter that will provide efficient power to your laptop over extended periods of time without heating up.  Feat
genjism,High pressure car washing machine,30.0,1,32,Brand new complete set with hose Can nego  #cars #motor #washing #cleaning #new
hazgo,Sennheiser MOMENTUM True Wireless Bluetooth Earbuds,199.0,0,20,Sennheiser MOMENTUM True Wireless Bluetooth Earbuds with Fingertip Touch Control Bought in 2019. Didn't use much.  Letting go cos using Samsung Earbuds with Samsung phone.  Price non nego. Will not reply to nego n trade. Delivery not included.
dc_auctions,"Brunt Blind Engine - Smart Motorized Blind, Make Your Existing Blind To Smart, Automated, Motorized Blind, Connected Home, Home Automation, Compatible with Amazon Alexa and Google Assistant",79.9,1,9,Brand new  https://www.brunt.co/us/goods/goods_view.php?goodsNo=1000000014  https://www.amazon.co.uk/Brunt-Blind-Engine-Automation-Compatible/dp/B0797W31BQ  About this item  💯 【CONNECTED WITH SMARTPHONE】 : Motorize your own blind and control on your smart devices.  🎁 【MOBILE CONTROL】 : Raise and low
stylelifeenterprise1,Type C To VGA Adapter Male To VGA Female Converter Adapter for Macbook,10.0,1,3,Feature  Standard USB3.1 Type-C  Supports USB 3.1 input and VGA output  Flexible USB Type-C Switching Support for USB 5G and DisplayPort 1.2 Alt mode  Supports VGA 225 MHz / 2.25 Gbps per channel (6.75Gbps all channel) bandwidth  Supports DVI 12 bit per channel (36 bit all channel) deep color  Suppo
joseph_lim_cs,Casement Aircon Europace EAC 393,340.0,0,28,Good news for those having Europace Casement aircon!! And my existing Europace  Casement aircon Customer  1. NEW CUSTOMERS  If your Europace Casement aircon not working or Spoiled you can trade in yours or change one unit to  Model EAC393 Europace Casement aircon.   It come with removing your Spoile
confirm_value_for_money,🆕Apple AirPods 2nd Gem wire charging case (sealed),179.0,1,10,"Description  ✅Your attitude reflects My attitude ✅Fixed price ✅Fixed pick up location at Blk 801 yishun ring road S760801 ✅No entertain to bargain, no deal if cannot accept “fixed price, fixed location” ✅No entertain to photo request, if insist to see sealed box photo, kindly contact manufacturer. ✅"
m_ouse,Yamaha WX-030,140.0,0,18,Price negotiable Still in excellent condition Use inside room only
acerasus,"lapbook pro 14"" chuwi laptop *hinge issue",199.0,0,10,"READ DESCRIPTION AND SPECS
 
 Intel n4100 cpu / 8 gb ddr4 ram / 256gb ssd / UHD 600 graphics / 14.1 inch IPS FHD screen / windows 10 home / 4900 mah battery / 6 months old
 
 metal bracket of hinge and brass inset came off (see pics), repairs will cost around $80 - 100 (will give you contact)
 wifi "
justclearingstuff2020,convertor HDMI VGA USB-C,16.0,1,6,bought it but couldnt use/test for my mac as my mac is macbook air instead of macbook pro. New.
premium.affordable,Smart Alarm Clock/Temperature/Micro Light Sensor AQ138 (Black),12.0,1,2,"•	ED backlight at night  •	Micro-Light Sensor: When the luminance of room is lower than 15lux (approx.), the light sensor will trigger the micro-light on   •	Beep Alarm with snooze function and 2-range loudness switchable  •	Available in Pearl White and Pure Black  "
buy_stuf4280,Gaming pc,800.0,0,1,Desktops
mrcasteels,GT 1030,60.0,0,1,"used GT 1030 works perfectly, great for gaming and work, will provide delivery free of charge if match price"
rodneyboey,Turntable With Speakers Vintage Phonograph Record Player Stereo Sound,48.0,1,3,"PU leather wooden box, fashionable design, simple and generous. Three speed, compatible with most of the records on the market. Ruby needle for accurate pickup. Easy to operate and play music conveniently. Built-in speakers and tone arm with soft damping control add to its exquisiteness. Compatible"
bleath,Zotac GTX 1070 ti,350.0,0,59,Used gtx 1070 ti but in good working condition.selling cause I want to upgrade to a better gpu. 1070 ti is equivalent to rtx 2060.
honduras_,Samsung 27' Curved Monitor,200.0,0,19,"Samsung Curved 27' Monitor  1920x1080 Full HD  60Hz refresh rate   After buying rarely used as I also bought a laptop.  In tip-top condition.   Great for WFH or school use as it is large and clear, with deep blacks as usual for a Samsung Panel, same as their smartphone"
jarylchan,MagicForce 68 key Mechanical Keyboard,55.0,1,3,"New Magicforce 68 silver edition still in box and plastic wrapping  Uses Kailh red switches  Blue backlighting with orange leds for wasd and arrow keys   Price is fixed, please do not lowball Lowballers will be ignored Do not ask me for best/lowest price, price is FIXED           Tags: magicforce 68"
yangsellers,Lenovo Yogabook,519.0,0,1,"Well-kept device Used for roughly a year Runs on ssd Everything included, power adaptor, stylus pen etc Physical condition: 9/10 Small and convenient Feel free to dm me😄"
ninjaelegy,Vortex Vibe Keyboard (MX Brown),120.0,0,11,Selling lightly used Vortex Vibe Keyboard with Cherry MX Brown switches. Bought them a few months ago but decided to switch to different type of keyboard.  Comes with original packaging and included extra keycaps.  Deal in Tampines on weekends and Chinatown on weekdays. 
redzapple,2018 New Akaso EK7000 4K Sports Action Camera WIFI Waterproof DVR Camcorder 12MP,79.0,1,16,"Professional Video Quality AKASO EK7000 features ultra HD 4K video recording. You can capture stunning 4K 25fps/2.7K 30fps/1080P 60fps video which is sharper and more lifelike than ever. High-resolution, high frame rate 4K 25fps and 2.7K 30fps video deliver distinctly smooth video.  Fast, Powerful P"
jacrpl,500GB hard disk,15.0,0,17,"Sell off extra hard disk (500GB) X 2 Both for $15 Price firm, only sincere buyer Both are empty disk. PM me if you need Windows OS to be installed."
lav885,Dell Optiplex 9010,350.0,0,13,"Dell Optiplex 9010, Intel i5, 16gb Ram, 250gb SSD and 1TB hdd, fast and powerful. Windows 10 Pro w/ Microsoft Office"
tengkai87,IPad Pro 11” (2018) 256 GB wifi + cellular,1400.0,0,10,"Selling iPad Pro 11” 2018, 256 GB with wifi+ cellular. Good condition as barely used, been using macbook more.   Selling with Apple Pencil 2."
eroundshop,"NEW Philips Micro Music System BTM2310/12 with Bluetooth CD, MP3-CD, USB, FM USB port for charging",216.9,1,4,"FREE DELIVERY  Relax to great music Obsessed with sound Listen to your smartphone tunes, stream your music library over Bluetooth and play MP3- CDs on this compact, all-in-one Philips music system. Charge all your smart devices, from smartphones to tablets with the built-in USB charging port. Enrich"
chyen01,Laconic Lab Night Blues Mini Headphone Amp,450.0,0,18,"Unobtainium amp from Russia which is extremely difficult to import to SG due to strict export policy from Russia.  I paid a few times of shipping arrangement + duty just to bring this here and was not disappointed.   Highly praised on SBAF, a very solid performer at its price range. Pairs really wel"
dc_auctions,"dodocool ,2018 New Technology- Steamer for Clothes-180ML, 5-in-1 Steamer Clothes,Garment Steamer,Fabric Steamer,Travel Steamer,Handheld Steamer Wrinkle Remover Automatic Shut-Off Safety Protection",17.9,1,2,"Brand new  About this item [Baffle Design To Protect Your Hand and Clothes Safe]- dodocool personal steamer for clothes adopts the advanced technology, special baffle design to prevent mist liquefaction and boiling water sprayed.This steamer will automatically cut power off when the unit overheats o"
keykaboo,Star Trek Beyond Mousepad,15.0,1,20,"Brand new 30x80cm mouspad  Good for gaming and working !! (Quality similar to Razer ,however it's much bigger in size ) Enhance the look your gaming /working environment!🙆🙆    Magicforce,razer,ajazz,blackwidow,switch,blue,black,red,brown,RGB,mechanical,keyboard,gaming,pbt,abs,corsair,steelseries,qui"
tzl2611,Toshiba 500gb hard disk (freshly formatted),15.0,0,9,Selling a Toshiba 500gb hard disk for only $15 ! In very good condition 👍  Does comes with the sata connector in case you do not have one !   Chat with me if interested 😉
daigua,Incase MacBook Air 13 retina 2018,35.0,1,3,"Original incase for MacBook Air 13, 2018 model. Blue color and cloth texture"
lazydog226,Laptop stand( for any size),17.0,1,4,"Ergonomic design help you put the laptop or notebook screen to eye level at 5different height settings to fit your preferred viewing angle, correct your posture, so as to prevent the incurable spinal cord injury. High-quality rust-proof aluminum alloy presents excellent product look, scratch-resista"
sharelink_click,Adjustable Foldable Aluminum Laptop Stand Non-slip Desktop Notebook Holder Laptop Stand (Qoo10),11.9,1,7,"I don't own it, sharing item only.                             ↓Click↓ https://qoo.tn/BnC8tW/Q146549380 Sold by MIAOJIANG. To Coupon $10  :  https://sg.carousell.com/p/287554139"
olahomesingapore,Vacuum Sealing Machine,65.0,1,4,"🏪🛍️👪 OM Outlet - Your Preferred Lifestyle Store  🆓🚗 FREE DELIVERY!  🤩💫 MOST affordable prices! 💫🤩  Thank you for visiting our store! 🙏🙏 📲 For our complete list of products, please check out our main page: https://sg.carousell.com/olahomesingapore/  Vacuum sealing machine helps you seal and preserve "
xtremesolution,Logitech G Pro wireless - Pink - Pre - order,349.0,1,3,Pre-order now. Estimate arrival Mid Jun.  
cctvbros_wilson,Samsung sound bar hw-H751,200.0,0,5,Samsung sound bar for sales
honestselling276,Bluetooth Yamaha amplifier free book onkyo denon speakers soundbar home theatre systems,158.0,0,7,"works 10/10. No remote. Testing provided.Play using bluetooth add $28. https://www.hifiengine.com/manual_library/yamaha/ax-396.shtml  Clearing!!!   go to  carousell.com/honest276 or my friend carousell.com/honestselling276 .Many items clearing, more Bowers & Wilkins ,Quad,Yamaha, Denon, Nad ,monitor"
ffaithh,13 MacBook Pro 256GB,879.0,0,55,Selling MacBook Pro 13 inch 256GB in absolutely pristine condition as shown in the photos.     Screen protector attached since day one  Screen has absolutely no scratches  Keyboard is fresh & free of dirt & dust  Mac is never used without keyboard protector (will be included in your purchase of this
kk1985,HyperX cloud alpha,120.0,0,1,Bought the wrong model by mistake. One day old. 
skylelong,"Jellas Orbital Sander, 280W 125MM Sander Machine with 13000RPM 6 Variable Speed, Dust Collection Bag, 360°Rotating Sanding Base Plate, 3Meter Power Cord Random Orbit Sander",71.0,1,9,"▶【Powerful Operating System】The wood sander machine is 280W for high power demands, the maximum power can reach to 300W. Its premium pure copper motor works up to 13000 rpm. Good heat resistance and good cooling system prevent burn-in due to overheating when use for a long time. ▶【360° Rotating Base"
glay78,Apple IIe with Colour Monitor,2999.0,0,29,Original 1983 Apple IIe set for sale.  Comes with  Apple IIe upgraded 128k memory AppleColor Composite Monitor IIe 2 x 5.25” Disk Drive Joystick  Some games in disk Floppy disk emulator (allows copy of games downloaded from internet to run on SD Card)  Fully working set.   Top up $200 for a monochro
ravenblake,Beats Solo3 Wireless,100.0,0,11,rose gold  retail price $279  selling it away as i haven’t been utilising it :(  very good condition.  comes with the carrying case. 
yltcefrepmi.perfect,Samsung AKG earpiece (3.5),10.0,1,5,Availability: 3 instocks   We have both Made in Vietnam 🇻🇳 and made in China 🇨🇳  Refer to pics 9&10 for real life pics   Price includes free normal mailing  Restocks at every start of each month  Refer to bio for payment methods   Happy shopping 🛍   
katherinee,Huawei Freelace,42.0,1,1,Audio
laxsell,Bluetooth Speaker,20.0,1,4,"100% BRAND NEW:  Wireless Bluetooth Speaker With LED Colour Touch Lamp  Connect your phone, tablet or computer to the magnificently sounding Thumbs Up Bluetooth Speaker that truly has to be heard to be believed, with stereo sound that will awaken your musical soul with its stunning quality and audio"
tehiain,Powerbeats 3 Wireless,200.0,1,1,PowerBeats3 Wireless. Only the left wire is out. Opened packaging but unit is still not used. Meet up @Bukit Gombak MRT. 
charliemate,Lenovo Yoga S749 - 15inch,2150.0,1,3,"BNIB  Processor Intel Core i7-9750H Processor ( 2.60GHz 12MB )  Operating System Windows 10 Home 64  Display Type 15.6""FHD IPS Glare LED Backlight Narrow Bezel 1920x1080  Memory 16.0GB PC4-21300 DDR4 SODIMM SODIMM 2666MHz  Hard Drive 1TB SSD PCIe NVMe  Warranty One year Carry-in  Graphics GTX 1650 4"
joeashvin,TOPROAD A100 Portable Bluetooth Speaker Wireless Stereo Bass Subwoofer with FM Radio Remote Control,88.0,1,2,"Description  Features   - Portable Bluetooth Speaker,built-in bluetooth 4.1 wireless transmission, working distance up to 10 meters. - Compatible with all Bluetooth devices such as smart phones, tablet PCs, iPOD ... - Support TF Card music playback. - Support FM radio, FM channel automatically - Sup"
dc_auctions,"Bluetooth Speaker, MIFA Soundbox Bluetooth Portable 30W with DSP Bass Sound, TWS Speaker, 4000 mAh, 66ft, Three Passive Sub-woofers, Wireless Speakers with Mic for iPhone, iPad, Samsung, etc.",19.9,0,1,"Used. Some scratches at the bottom. Refer to last 2 pic  Features & details Bluetooth Wireless Stereo Speaker: TWS function helps you link TWO A20 speakers to form Surround Sound and help you enjoy 3D surround music at home, garden, pool side or park Good Sound Bluetooth Speaker: Dual 15W speakerpho"
applet_csh,Hydroponics gardening,70.0,1,18,Meetup Sg: true Delivery Sg: false
contraled,Cambridge Audio Minx 5.1 home theatre speakers,600.0,0,15,"Cambridge Audio Minx home theatre system consisting of 5 min10 satellites and 1 X200 powered subwoofer, all gloss back. All in mint condition with boxes. Using balanced Mode radiator technology and very small and living room friendly. Sound and build quality much better than Bose. Very small and dis"
reko3177,Powerpac Electric Clip Fan,19.9,1,10,new compact light weight
mrs__,Dell OptiPlex 7010 USFF (i5-3470S),180.0,0,7,CPU: i5-3470S RAM: 4 GB HDD: 500 GB Have charge GST 7%
miraideals,Western Digital 1TB NVME M.2,171.62,1,9,"Not selling. Just here to recommend this NVME at amazing price performance ratio ☑️Link: https://amzn.to/35XOWLj ☑️(Select Amazon US as seller)  Don't worry about Warranty as WD provides local RMA even if you buy overseas set unlike other brands. With the increased price in NVME, this item is the be"
dope06,Airpod Gen 1,100.0,0,5,Used airpod gen 1. Working fine. The wording L & R wore off and right side got cracked but doesn’t affect the sound. Got box and two case
onlinehome,New Modern DIY Chic Modern Large Wall Clock 3D Mirror Surface Art Sticker,18.8,1,12,"Quantity:1PC Battery: 1*AA battery(not included) Item Materials: Acrylic Color:Black, Gold, Silver 100% Brand new and high quality. Package Include: 1PC Removable Diy Acrylic 3D Mirror Wall Sticker Decorative Clock (Battery not inluded) The wall clock is 3D effect Easy to install and remove the stic"
camelia89,Samsung sport smart watch,200.0,0,19,item still in good conditio 10/10. comes with full box. use only once. price can be neg. only for serious buyer.
kilkennydonegal,Yamaha Amplifier rx v1500,300.0,0,2,"amazing reciever for movie and audio. i have dvd,cd and phono(record player) tv connected and all sound amazing. a bit heavy but will last a life time. come with remote"
titihuat,Lowest Price Thumbdrive !!! 16gb -Only $8!!!  100% Authentic !!! Ultra Flair !!! NEW!!!,8.0,1,15,Lowest Price Thumb drive !!! 16gb -Only $8!!! Ultra Flair !!!  16gb - S$8 32gb -S$11 64gb -S$16 128gb-S$21  Collection :AMK AVE 4
goodstuffsg,Bluetooth Speaker Transformers Bumblebee LED with FM,24.0,1,7,Free delivery via standard EXPRESS mail  1. Controller: 24mm 2. Impedance: 32 OHM 3 Bluetooth version: Bluetooth v5.0 4. Bluetooth use band: 2.4 GHz 5. Power level: Class II 6. Output power: 3 W 7. Bluetooth distance: 10 meter barrier 8. Frequency response: 20-20000Hz 9. Operating voltage range: 3.0
sgpcparts,Zotac Gtx 1070 mini 8gb,240.0,0,62,Condition 8/10 Require 8pin pci e power cable Pm for more info
electronicsforsalesg,PHILIPS  ALARM  CLOCK  RADIO,29.9,1,9,PHILIPS  RADIO ALARM  CLOCK  DUAL & REPEAT ALARM  GENTLE WAKE & SLEEP TIMER SHOWROOM DISPLAYED MODEL BUT NEW
nvx_si,Sapphire PULSE RX 5500 XT 8GB GDDR6 (11295-01-20G),310.0,1,10,"Credit Cards Accepted! (Surcharge Applicable)  Enquire for onsite support or services at a nominal fee.  2 years local carry-in warranty (first 14 days 1 to 1 onsite exchange) from date of purchase, with proof of purchase against caveat emptor.  Self collect on weekends at Boon Keng Station or prepa"
darrenokq,**CH 5.1  LG Speaker Set/ Subwoofer WITHOUT Player/Amplifier**,150.0,0,4,"*5.1 Surround Sound Speakers  for Home Entertainment* **Wired Speakers WITHOUT Player/Amplifier**  Output Front (L/R) - 167 W x 2 Output Surround (L/R) - 167 W x 2 Power Output Center - 167W Power Output Subwoofer - 167W  *Rarely Used *Condition 9/10  Fast Sale!  Fixed Price,  Good Sound Quality"
suryanto_lee,Beats Studio3 Wireless Headphones - Midnight Black (NEW),360.0,1,1,"Improve your work from home experience with Beats Studio3 Wireless Headphone, a high-end Apple Beats designed product that gives you ultimate experience in video conferencing, listening to music you love and doing exercise at home."
renquan,Neoteck Headphone Amplifier Portable 3.5mm Audio Rechargeable HiFi Earphone Headphone Amplifier with Lithium Battery and Aluminum Matte Surface Ideal for MP3 MP4 Phones Digital Players and Computers,35.0,1,4," 【Mini HiFi Headphone Amplifier】It is Delicate, Compact, Lightweight, and Portable that it can be Carry Conveniently
 【3.5mm AUX Input and Output】3.5mm AUX Input and Output, SNR>100Db and THD+N 0.0003%, Make it Possibility to Output not just Louder Sound, but a Sharper and More Real Stereo Sound wit"
