Seller,Product,Price,Quality,Likes,Comments
b0b3rts,Cable Sata PSU,5.0,0,7,SATA Cable Molex male to 4-Pin PCIE 5-Pin to 4-Pin Molex female
a.i.p.l,Sennheiser noice isolation earphones,100.0,1,2,Brand new in box. Comes with aircraft adapted 
merviano,Sennheiser Momentum True Wireless,200.0,0,6,"Used it only for a month but haven’t had much chance to use it.  Comes with box and warranty still.  Selling it way cheaper than retail  (Some dust particles in the pics but i’ve wiped them off no worries)    Tags: apple, android, beats, audio technica, wireless earpiece, jabra, airpods"
guitarnewbie,Klipsch Reference R6i,88.0,1,3,Brand new in Box. Never used. 1 Year Warranty.
kommade,$120 for 2 Nokia Beacon 1  mesh routers,120.0,1,4,Brand New Nokia Mesh Routers. Just got it from Starhub and have no need for it as already have mesh router network at home.
jess12345,Vention USB External Sound Card,12.0,1,1,Others
diine,1327) i17 Tws Bluetooth Earphones Wireless Earbuds Sport Earphone In-ear Earphones Mic,18.0,1,4,"Brand new with box What you see is what you will get  TWS i17 Wireless Bluetooth 5 Earphones Dual EarbudsDescription: Item Type: earphone Model: i17 bluetooth headset Color: white/black/green/pink/purple Bluetooth solution: jerry 6936, support binaural call Horn: high quality genuine brass ring horn"
zalpha,Lenovo desktop,180.0,0,4,Desktops
circuit.bots,Desolder Pump,8.0,1,2,"Free Shipping!  ⛏️Technical Specifications:⛏️ ✅ High Suction ✅ Built-in Tip ✅ Material: Metal  💰Payments💰 💵 Cash (If you do not have exact change, please tell me in advance) 💵 Bank Transfer 💵 Payla & Paynow  📬Delivery Options📬 😁 Self-Collection: FREE (Meetup venue discussable) ✉️ Singpost (No-Tracki"
btkh95,Marshall Monitor Headphones,160.0,1,8,"As good as NEW, opened but not used. All the gold plating is still there and shiny.   Non-bluetooth version   RFS: Bought for Dad, but he already had Bose and preferred those. Been kept for quite a while, no receipt unfortunately.  Priced to clear, thanks!"
onlyqmall,GameSir X1 BattleDock Converter Keyboard Mouse Adapter For PUBG FPS Games,40.0,1,24,"✨ [Pre Order] PRODUCT ✨
 ⌚ Receive parcel within 10 days 
 🚚 Postage: 🆓 Free by courier/singpost
 🈹 Discount $2 for 2pcs/sets onward 
 ✅ All product warranty 2 days,If have issue can be refund.
 ❌ No Cash On Delivery, No Viewing, No Exchange.
 
 🌹🌹🛒 TO ORDER 🛒🌹🌹
 
 Orders will only be process ASAP o"
shoptillsot,"Ventio 16"" Pedestal Oscillating Stand Electric Fan 3 Speed Office Cooling (White)",33.0,1,4,"NEW 2019 Model - 16 inch oscillating fan - Ideal for homes and offices 3 speed options for maximum convenience Sturdy, solid 2 kg round base Adjustable height and tilting head for optimum comfort Oscillating head for wide cooling effect   ✅Boxes are opened for quality checked and some boxes might be"
mambaboomba,Yamaha NP-S303 Network Player (rare!) BNIB,400.0,1,7,"Negotiable  Completely unopened , unused , BNIB   https://sg.yamaha.com/en/products/audio_visual/hifi_components/np-s303/index.html"
ohsobudget,KKmoon 10PCS Airbrush Glass & PP Bottles 3/4oz 22cc Air Brush Bottle Jars with Plastic Lid Using on Airbrushes,18.0,1,5," The standard 3/4 oz bottles that can screw onto the plastic lid assemblies of both the 30° and 60° adapter connections for all airbrushes.
 These 22cc glass bottles are perfect for Master airbrush.
 Fit all the airbrush brands: for Iwata, Master, Badger, Paasche, etc.
 1 Box of 10 3/4oz glass / PP "
novaol,Lenovo E73 Desktop (ThinkCentre) Type 10AS,180.0,0,8,Condition : Under Utilized 10/10 Low-Ballers Will Not Be Entertained  Specs Below : - Processor : Intel Core i3-4130   Memory : 4GB RAM  Hard Disk : 500GB 7200RPM S-ATA HDD  Diskette Drive : No  Size :  Tower Form Factor Graphics : Intel HD Graphics  DVD Rom : DVD Recordable  LAN : Gigabit Ethernet 
greeniemeng,Akarui Digi Dry Cabinet E26D,50.0,0,5,"The Dry Cabinet E26D controls the humidity so your tools, especially the camera and lenses, are kept dry and safe. Inside the dry box, the temperature does not go up or down; it basically remains the same as the temperature of the room it is placed in. *****Please note that this Akarui Dry Cabinet i"
cluwy,Roksan CD Player and Integrated Amplifier,1800.0,0,9,"1. Roksan K3 Integrated Amplifier -$1,600 2. Roksan K3 CD DI - $1,700  Paid more than $5k for both when I bought them brand new in Aug15. 5 year warranty will end in Aug20. Comes with 2 identical remotes as both CD player and amplifier came with it. One remote is brand new.  "
iiiibuysell,Cpu cpu cpu cpu,499.0,0,1,i5-3470 @3.6ghz  gaming cpu Gtx 1050 graphic card Ssd 240gb fast start up 8gb ram ddr3 WiFi cable  Fully Working Condition  Free Delivery  2 week warranty   We install for original Window 10 64bit and office 2019 and photoshop PDF reader VLC player AVG Antivirus software and more.....  What is an SS
gamesbooks,(FREE DELIVERY) Midea Aircon Remote Control,17.5,1,2,"Hi everyone, all items are brand new. We provide free delivery for all our items, no meet up option. Discount if you buy more than 1 item.  Model: RG36F/BGEF Requires 2 x AAA batteries (not included)."
turbowatch,Apple Thunderbolt Display / monitor  (27 inch),590.0,0,25,"Apple Thunderbolt Display 27 inch in very good condition  Not the Cinema Display type and this comes with more ports USB A, thunderbolt and ethernet. Perfect screen setup for MAC users.   Misplaced box but this is in very good condition still. All cables are good condition  Looking to get a smaller "
fastcheapodeals,KKmoon 10PCS Airbrush Glass & PP Bottles 3/4oz 22cc Air Brush Bottle Jars with Plastic Lid Using on Airbrushes,18.0,1,6,"The standard 3/4 oz bottles that can screw onto the plastic lid assemblies of both the 30° and 60° adapter connections for all airbrushes.
 
 These 22cc glass bottles are perfect for Master airbrush.
 
 Fit all the airbrush brands: for Iwata, Master, Badger, Paasche, etc.
 
 1 Box of 10 3/4oz glass "
honey.lemon.sale,Pyle Acoustic Isolation Microphone Absorber Shield Absorber Shield,199.0,1,34,"New stock. RECORD YOUR VOCALS STUDIO PRO: If you looking for a top quality, soundproofing solution for your vocal recordings? Then look no further than this studio microphone isolation shield enclosure! Boasting a strong, metal shell with 5 acoustic foam panels that will block off outside noise, suc"
maby,[White] Logitech Bluetooth Keyboard,38.0,1,9,Brand new. But box is a bit dented during shipment. It’s opened to checked for damage.  Logitech Bluetooth Wireless Keyboard K480.  Suitable for working from home.
skyblue83,X1 Carbon i7-3667u 8GB RAM 256GB SSD very fast working light weight 3hours+ battery 1 month testing warranty,475.0,0,17,Excellent condition  Actual photo attached  Core i7 gen 3 8gb ram 256gb ssd  Windows 10 installed  Ms office installed  1 month testing warranty  
tanchie,Lenovo usb-C hub c109,38.0,1,4,non nego self collect yishun st 51
malcolm.lee.2008,Asus RT-AC3200 Wireless Router,100.0,0,6,Free delivery
hansng88,"♥️Lastest Android 10: Tx6s - 4GB ram 32GB rom loaded with apps+ support 6k, android tv box latest, android tv box 4k, android tv box 4k 4gb, android tv box x96, android tv box channel, android tv box 2020, netflix",130.0,1,250,"9999 boxes sold by me!!
 This my new account, 
 Whatsapp 91058020 for fast response Hans and demo video*
 WhatsApp click here =>> https://bit.ly/37a4mfM
 
 Android Tv Box Available:
 
 1) Model T9:  4GB ram + 32GB rom android 9 with blue tooth function with 2.4G/5G wifi ===>    $120 (instock)
 https"
cheap_gadget,Mini HDMI to RCA AV Adapter,12.0,1,10,Brand New with Packaging.   Self collect at Blk 160 Yishun St11.
laxsell,WiFi Camera,30.0,1,1,"100% BRAND NEW:  DADYPET Pet Camera, Baby Monitor, WiFi Camera, 1080P FHD Wireless IP Security Home Dome Camera with Night Vision/Two-Way Audio/Cloud Storage/Motion Detection by DADYPET  Remote Control & Motion Detection】: The surveillance camera control with 2.4Ghz WIFI, no matter where you are, Da"
tango51,[USED] Lenovo Thinkcentre E73 Desktop,220.0,0,16,Old Desktop at storeroom no longer needed. In good condition and can use for work and daily usage.   [USED] Lenovo Thinkcentre E73 Desktop  Window 10 Pro (Latest OS Version 1909) Processor: i5-4590S RAM: 4GB HDD: 450GB  S/N: PC009R6M  Warranty: OUT-OF-WARRANTY [BUY AT YOUR OWN RISK]   **PLEASE SEE  
hydratoraudio,Behringer 1002  Premium 10-Input 2-Bus Mixer with XENYX Mic Preamps and British EQs,95.0,1,42,"Item brand new in box without warranty. Free shipping
 
 
 
     Premium, ultra-low noise, high headroom analog mixer
     2 state-of-the-art XENYX Mic Preamps comparable to stand-alone boutique preamps
     Neo-classic ""British"" 3-band EQs for warm and musical sound
     1 post fader FX send per ch"
b_b_q,Marshall Acton,220.0,0,12,Very good condition Marshall Acton (not Acton 2) nice sound. Sell to upgrade.
books4lyfe,HOT! UGREEN AUDIO SPLITTER,6.0,1,11,New audio splitter 3.5mm good quality!
djblackfm,Acoustic Panels (Proferated membrane fabric),159.0,1,49,"Pro Sound Acoustic Panels (perforated membrane fabric), purely breathable for maximum performance! Quality definitely way better than any other panels out there!  Have a dedicated home theatre? Or are you a serious audiophile? Do you have ideas in designing your home with quality acoustic panels but"
musicintolerant,"Aftershock lunar 14 ULTRABOOK (1kg, 12 hour battery life)",1350.0,0,2,Specs in 2nd pic. SRP $1613 About 1 year + warranty left. Intel i7-8565U (8th Generation Intel Processor) NVIDIA GeForce MX250 2GB GDDR5 8GB (8GBx1) RAM 512GB M.2 SSD  Condition 9.5/10 Can do light gaming. Extremely light.
puppiescutee,Apple Watch Series 1 ceramic,170.0,0,1,With box and charger  No dent  All working well
toyourdoorstep,"Gocheer Professional Airbrush Kit, Mini Airbrush Single Action Model Airbrush Gun USB Rechargeable Air Brush Pen for Makeup Art Nail Painting Tattoo Manicure Cakes DIY Tool with Quiet Air Compressor

￼

￼

￼

￼

￼

￼

￼",76.0,1,14,"The popular Gocheer rechargeable airbrush on YouTube! We appreciate your trust in Gocheer professional airbrush and hope you will be happy via using this portable airbrush apply to makeup, art ,nail painting, tattoo, manicure, cakes DIY .  ￼  Specifications:  Battery capacity: 700mAh  Charging time:"
shacolee,JBL Flip 4,80.0,1,2,Condition: 10/10  camo wireless bluetooth strap
xenobaka,Audio Technical AT2035 Cardioid Condenser Microphone,180.0,0,10,Conservatively classified this as used as it was only used once for comparison with my other mics. Essentially mint to brand new in box. Everything in the box included. See pictures. 1 week personal warranty. Check my reviews. Buy with confidence.   Free delivery if not too far away. Message me. 
ku.ka.raja,Harman/kardon 5.1 ch AV receiver Surround system,399.0,0,14,"Harman/Kardon 5.1 ch AV receiver, Surround system, used but 100% working condition, speaker wires not included, can buy from outside for $5-$10"
an8828,MacBook Pro,330.0,0,37,"Selling a 13” MacBook Pro! Bought in 2010. Perfect for individuals who are trying Mac for the first time and just want to have a feel. Or for individuals doing basic tasks like email, web browsing, photo management. Ideal for students too!   Detailed Specs: Processor: 2.53GHz Intel Core 2 Duo RAM: 4"
giftsurprises,Rode Wireless Go Compact Wireless Microphone System/Ready Stock/Local 1 Year Warranty/Fast Delivery,247.0,1,20,"~Features~ •The receiver's 3.5mm TRS output sends a mic-level signal, making it compatible with an array of devices such as DSLRs and portable audio recorders.  •Low, medium, and high (0 dB, -6 dB, and -12 dB) receiver gain settings allow simple and effective optimization of signal levels.  •View tr"
minniemimi23,LED Mini Projector,60.0,1,4,"The Mini Projector is the product you never knew existed! You can now enjoy all your favourite video games, TV shows and films in theater style, anywhere anytime! The Official Mini Projector can plug into your laptop, iPhone, Apple TV, Android, Amazon Fire, Samsung or video game console with a HDMI "
csinmaz,MacBook Air 2019 GREY i5/128gb,1330.0,1,142,BRAND NEW SEAL NOT ACTIVATED MBA 2019 GREY COLOUR.  *Warranty  1 year from day u activate*  13.3”. With True Tone tech. 1.6ghz dual core intel i5  8gb SDRAM 128gb SSD 2 thunder bolt 3 USB -C ports headphone jack / stereo speakers. TOUCH ID Face Time Hd camera. pre installed MacOs.  BOUGHT FROM USA N
okdaz,Samurai dry digital cabinet #JuneHoliday30,80.0,1,21,💯 % brand new can nego for fast deals
siol.pte.ltd,Screen Mirroring,29.9,1,3,Ready Stocks✅
stuffstoclear,QuickCam BNIB,20.0,1,21,"Logitech Quickcam Pro for Notebooks Notebook Webcam includes Logitech Vid Now video calling which is free, fast, and easy for you and anyone you want to talk to. It's built into your webcam setup, so you can call right away. Your images stay razor sharp, even in close-ups (up to 10 cm from the camer"
mj_electronics,"Soatasoa Wifi Adapter 1200Mbps Dual Band (5G/867Mbps + 2.4G/300Mbps), USB 3.0 Wifi Dongle with 5dBi Antenna Wireless Network Adapter for PC/Desktop",15.0,1,8,"ULTRA-SPEED - Usb Wifi Dongle Up to 1200Mbps Wi-Fi speeds on 5GHz (867Mbps) or 2.4GHz (300Mbps) bands for pc, Performance to reduce freezing and lags when streaming and gaming. Ultra-fast AC1200 wireless adapter speed with 802.11ac. SUPERSPEED USB 3.0 PORT - USB 3.0 supports transfer rates of up to "
tango51,[USED] Lenovo Thinkcentre E91 Desktop,180.0,0,32,Old Desktop at storeroom no longer needed. In good condition and can use for work and daily usage.   [USED] Lenovo Thinkcentre E91 Desktop  Window 10 Pro (Latest OS Version 1909) Processor: i7-2600 RAM: 4GB HDD: 1TB  S/N: PBAMH05  Warranty: OUT-OF-WARRANTY [BUY AT YOUR OWN RISK]   **PLEASE SEE   DOE
premium.affordable,Kano Disney Frozen 2 Coding Kit,50.0,1,1,"•	Build a sensor – Detect 3D hand motions. Powerful light beams. Learn how it works as you build. Tablet not included.  •	Play with Frozen powers – Make fractals, build Olaf, conjure an ice palace. Create rainbow snowflakes, fill the screen with mini Svens, throw snowballs. Play with Elsa, Anna, Ola"
daydreamersss,Urbanista paris earpiece in rosegold,90.0,1,1,Used for photos only. Brand new in package Rtp $159.90
tweetie_gal15,Asus Spoilt Laptop (repair or replace batt),100.0,0,5,Items as picture shown Everything good as in the keyboard  alphabet and number as shown in pictures  Unable to turn on could be Battery issue or just repair due to CB unable to travel to shops for repair bought a new one. so letting go. With delivery price quoted
miaamarican18,Asus Laptop ( Vivo Book ),400.0,1,97,Im selling it as I got A new apple laptop... Still in a good condition and also i use it only for 2 times :)
b3y0nd,Gigabyte GTX680 windforce 3x,50.0,0,23,2gb vram Can run various games with decent frames no box only anti static bag
ecoli8,electrostatic panel one pc only,250.0,0,7,Audio
music_maker,Mini drill grinder accessories compatible with Dremel,16.99,1,46,Come with compartment plastic tool box
akarkyaw,ASUS ROG CG8565 (Gaming PC) + Samsung Monitor,650.0,0,32,"ASUS ROG CG8565 + Samsung Monitor   ASUS ROG CG8565 Spec: - Intel core i7-2600K @3.4 Ghz - 8Gb RAM  - 256Gb SSD + 1 TB HDD - Nvidia GeForce GTX 750 Ti (upgraded not long ago) - Windows 7  - External condition: 8/10  - Internal condition: 10/10  Able to play Dota2, CSGO @ 100+ FPS   Present for you.."
lim9800,Yamaha Soundbar YSP1400 5.1CH Digital Projector Sound bar with Built-In Subwoofer,240.0,0,5,Yamaha YSP1400 5.1CH Digital Projector Soundbar with Built-In Subwoofer.  Experience precision audio sound quality with superior sonic bass performance.  Excellent original condition.   Overall condition 10/10 Original Remote  New Optical Audio Cable
thegadgetstall,DEPSTECH Wireless Endoscope,15.0,1,3,What you see is what you get    Additional courier $5
cmsittrading,XPS 13 4K (2020),2399.0,1,14,"10th Generation Intel® Core™ i7 10710U Processor 13.3"" 4K Ultra HD (3840 x 2160) Infinity Edge Touch Windows 10 Home (64bit) English 16GB RAM  512B M.2 SSD  Intel® UHD Graphics with shared graphics memory 2Yr Premium Support: Onsite Service"
just_sharing_sally,2974Mbps Wifi Card AX200 802.11Ac/Ax 5,36.0,1,7,"Here to share the link to the item :D
 Link to more information and the WiFi card:
 https://shopee.sg/Dual-Band-PCI-Express-WiFi-Card-Gigabit-for-Intel-AX200-2.4G-5Ghz-802.11Ac-Ax-5.-i.192710510.7717903610
 
 okay I listed this before and im gonna do it again AHAHHA. really nice value on some pretty"
onlyqmall,HUION H430P Digital Tablets OSU Game Tablet Signature Graphics Drawing Pen,50.0,1,40,"✨ [Pre Order] PRODUCT ✨
 ⌚ Receive parcel within 10 days 
 🚚 Postage: 🆓 Free by courier/singpost
 🈹 Discount $2 for 2pcs/sets onward 
 ✅ All product warranty 2 days,If have issue can be refund.
 ❌ No Cash On Delivery, No Viewing, No Exchange.
 
 🌹🌹🛒 TO ORDER 🛒🌹🌹
 
 Orders will only be process ASAP o"
winning_infinity,CNY Flash⚡️ Sales 🔥Brand New- 👍🏻LDNIO- 2 in 1 Power Socket + USB plug / Fast Charge Power Socket/ Extension Socket,20.0,1,59,"🔥Products is Brand new come with packaging Box!! 🔥For more details about this products information please refer to last picture.  🔥Limited stock only !! Hurry up!! Ask me anything about this products 😊  Doubt my products quality & genuine?  Feel free PM me for more details, Or take a look my feedbac"
yiquntec,"HP, Canon, Epson ink cartridge new stock",34.5,1,36,"HP, Canon, Epson ink cartridge new stock  Brand New; Different price for different model. Pls Check our profiles, or contact with our staff.  - Please show this carousell page to our staff for Offer Price; - Local Pick up, Fix Price, Cash Only;  - Recommend shop collect. ============================"
rk.sg,New High Quality Cat 7 Ethernet Cable,6.0,1,31,* Highly Recommended.  * Excellent internal wiring (High Quality Controlled)  * Black color won't turn yellowish over time * Stock available locally  * Free delivery via normal mail (send out immediately) * Tracked mail or meet up options available too  * Available Stock 0.5m @ S$6.00 only (Restocke
karen_ng25,"Apple Watch Nike Series 5 GPS, 44mm Space Grey Aluminium Case with Anthracite/Black Nike Sport Band - S/M",700.0,1,3,Brand new.   Chat me if you are interested. 
ridzmotor,AKG EARPIECE AUTHENTIC,10.0,1,7,-Akg AUTHENTIC ear piece  -BRAND NEW STOCKS HAVE ARRIVED  -cheapest in carousel -comes with free (sized earbuds) -slef-collect
yes7606,Toyota Sewing Machine ,188.0,1,12,Brand :TOYOTA Model :ECO15A
hs00050,Gocheer Professional Airbrush Kit,89.0,1,4,"The popular Gocheer usb charging airbrush on YouTube! We appreciate your trust in Gocheer professional airbrush and hope you will be happy via using this portable airbrush apply to cake decoration,make up,nails design,Tattoo,model painting,Red  Spray & Maintenance Method：How to spray: FIRST STEP: In"
premium.affordable,Display4top Portable Single-Action Airbrush Gun with Mini Airbrush Air Compressor Kit,50.0,1,5,"•	Multi-purpose precision gravity feed airbrush with a 0.3 mm needle/nozzle gravity fluid cup  •	360 degree airbrush holder for your convenient use of airbrush. Quite and durable mini air compressor, portable light weight and easy to carry around   •	Pro gravity feed airbrush kit for hobby paint cra"
jhea25,"Wood Grain Wireless Charger Qi 10W Fast Charging Pad Stand Compatible with Apple iPhone XS Max Xr X 8 Plus, Samsung Galaxy S9 Plus S8 Plus S7 S6 Edge Note 9, HUAWEI Mate 20 Pro and More",20.0,1,7,"【Wood Grain & Sailboat Shape Design】With its minimalist and elegant wood grain design, it blends seamlessly with any wooden furniture to enhance the appeal of your surroundings.Sailboat shape,sleek attractive design and easy to use in multiple locations such as home bedroom nightstand, office desk, "
dearbluesky,Digital TV box and antenna,50.0,0,9,New Digital TV Antenna and a used a new Media Solutions Digital TV box
matrix11,Linkstation Pro Duo NAS,100.0,0,20,NAS comes with 2 X 1GB HDD
cheesefishball,"HP EliteBook 830 G5 i5, 13”",600.0,0,4,"Excellent condition. 10/10  Just computer and charger, no box.  Warranty verifiable via HP."
heavencarts_husnaretail,Alquran digital po,79.0,1,29,AL-QURAN DIGITAL AL-FALAH (PREORDER)  Free Gifts : 1 ) Al Falah Gold Woven Bag 2 ) Tasbih Digital 3 ) Sejadah Travel Al-Falah  PAKEJ PRODUK: 1) Al-Quran Mushaf Uthmani Bersaiz A5 2) Pen Pembaca Digital 4GB / 8GB 3) Buku Qaida Noorania (Kaedah Membaca Al-Quran) 4) Buku Talking Dictionary (14 Bahasa A
littlestorz,Banana – Y Adapter / Converter,3.0,1,16,To convert 4mm banana plug to Y Connector. Y connector inner 6mm  Selling at $3 /pcs Selling Pack of 8 @$20 (Save $4)
riotcoke,Apple Watch Series 4 Stainless Steel 44mm (Discontinued),588.0,0,6,Looking for Stainless Steel model Apple Watch but find it too expensive? Look no further. Here is a Series 4 Stainless Steel model which Apple is no longer selling!! Case: Original stainless steel Size: 44mm Cosmetic Condition: 9.5/10 Working Condition: 10/10 Price comes with milanese and leather st
punggoldealz,(SALE) BN Naipo Seat Cushion with Ventilated & Heating Pad,45.0,1,5,"Features & details  【Pleasant ventilation function】 The pillow ventilation function through the air flow, which dries excessive heat and moisture from your back and hips, freeing you from sweat. Seat Cushion is perfect for 12V Car and van, home and office use  【Adjustable heating and ventilation fun"
fluffyfoodiecafe,SmooveJet 6-blade USB Rechargeable Portable Power Blender (OEM),19.9,1,40,"With the new SmooveJet 6-blade USB rechargeable portable power blender, now you can have the freedom of blending your favourite shakes, nutritional drinks, smoothies, and baby food any time, wherever you are!  SmooveJet portable blender is powered by a motor which has an incredible speed of 22000rev"
hotcpu,Lenovo desktop $50 for sell,50.0,0,42,Sell Lenovo desktop computer Can used for office  Homework  Youtube   Win 7 os Cpu: E7100  core 2 Ram:2GB HDD:80 GB DVD room  Win7 os  Let me know if you want  Thanks . 
meruchan,New! Mini Refrigerator (only warm),50.0,1,3,I bought this from Qoo10 to store my skin care but the cold function is not working. And  I can’t be bothered to return this during CB. So I’m selling it here to those who needs a mini fridge to keep things warm.  So only warm function is available for this fridge. 60-65 Celsius   Can use for  -  he
ilvdeal,Apple Magic Mouse,50.0,0,6,Box misplaced. Good condition
toysandguns,DJI spark drone flymore combo with filter lense,360.0,0,17,Super great condition spark set 1x DJI spark drone with propellers 2x batteries  1x controller  1x charger set  1 x 4 piece propeller set brand new  1x 4 piece propeller Guard set  1 x manual set 1x DJI BAG (no sling)  1x DJI foam box  1x SPARK set sling bag with handle carry(3rd party) 
cashconverterssg,WIFI SMART SOCKET,5.0,1,3,BUY THIS ITEM AT OUR WEBSITE AT  USE VOUCHER CODE : CB10OFF TO GET 10% DISCOUNT WITH NO MINIMUM SPENDING REQUIRED.  URL: https://www.cashconverters.sg/smart-plug-6800000070437.html
gamingspecialist,5D 4635 (NEW) Olixar for iPhone 11 Pro Tough Case - with 26 in 1 Survival Multi Tool - Protective Armour Cover - Credit Card Slot & Built in Stand - X-Ranger - Black,21.99,1,4,"Retail Price: $27.99 🔥 Buy from us & you save up to 20% 🔥  ✅ Please kindly read through the description of product given. (Items are exact to picture listed, unless otherwise stated)  ✅ Address and opening hours are stated on every page listing  (End of the page of Meet up/ Mailing tab).  💬 CHAT TO "
snuglucks,"Lenovo X1  Carbon Gen 1 / i5 3427U / 8GB RAM / 14"" Screen / 256 GB SSD / Fingerprint Reader",450.0,0,53,"Condition: Very Good. Minor Scratches (refer to photos). Working like new.  Warranty: No Warranty  Charger and laptop bag included  Specifications: OS: Windows 10 Pro Processor: 3rd Generation Intel Core i5-3427U (2.80 GHz, 3MB L3 Cache, 1333MHz FSB) Battery: 45Wh, Integrated, RapidCharge up to 80% "
ann2020,Samsung HT-H7500,88.0,0,9,"Samsung HT-H7500 home theater surround speakers set for sale ONLY   But I will Includes  - AV Head unit in 5th picture (for free) need repair - main power on off by itself,  otherwise the others function works just fine.  Good for those who knows how to repair.....   Pretty expensive set bought near"
jomosell.sg,**PROMO** Bose Sound Link Revolve (+) Plus Brand New and Sealed!,360.0,1,137,"Introducing the Soundlink Revolve Plus - the bigger brother of the popular Bose Revolve.  Retail Price: $459 PROMO SPECIAL: $360 (total savings of $99!)  **Happy to price match where possible.   Black or Silver.   Once bought, please prepare yourself to be the party hero! ;)    We recommend you go t"
mamuchachi,Zotac GTX 1660 super amp edition OC,330.0,0,2,price negotiable amp edition comes with a beefier backplate and comes factory overclocked out of the box can run up to 2040mhz lightly used for 2 months  condition 10/10 selling due to upgraded GPU so I have no use for this comes with box and all the included hardware have local warrenty (4 years 10
loyisneasyn,HP Deskjet 3630 Ink Printer,30.0,0,6,"Used once only  Put aside for more than a year, think ink needed replace   Like new and working condition(just tested to turn on and still working)  Self collect at my place (Toa Payoh area)"
pcnstuff,Acer Aspire E5-473 series (N15C1),300.0,0,14,i7-5500U 8GB RAM 500GB HDD  All new Windows 10 installed.  Charger and laptop bag included.  Under utilized as I have a few laptops already.
