,Seller,Product,Price,Quality,Likes,Comments,Category,Log Price,Log Likes
1381,newchapters.,"piercing gun -stainless steel for ear, nose, naval, body piercing gun ear stud earring",12.5,1,7,"Impress your friends with your cool new ear studs and earring!   How to use: 1. Put an ear stud in the adaptor. 2. Adjust the tension regulator to locked the position. 3. Put the gun to ear and aim the position (earlobe), hold the trigger to back the ear stud cradle. 4. Clean up both the gun and stu",audio_visual,2.6026896854443837,2.0794415416798357
1382,newchapters.,uv lamp for finger and toe nails analysis portable and pretty,8.0,1,7,"- great and affordable for personal Use! - good to use for small businesses!  Features: -UV light is not easy to break and eco-friendly with no harmful substance to the human body. -Short hardening time.  -9 LEDs, low power consumption, ultra-bright, visible over a long distance. -Can be used for se",lights,2.1972245773362196,2.0794415416798357
1383,newchapters.,"rotating party disco stage led light bulb parties, birthday celebration b22 and e27",8.5,1,7,"Impress your friends and relatives with this rotating disco lightbulb! Can be used in business, pubs, clubs, house, bedroom, apartment!  Big light bulb - $12.5 Small light bulb- $8.50 Adaptor-$5  B22 and E27 can be used!",lights,2.2512917986064953,2.0794415416798357
1384,newchapters.,digital weighing spoon measuring spoon with lcd screen kitchen scale,14.0,1,8,"Precision is the key to success!! Be the next chef Ramsay to prepare the best meal!  Ideal for business, cafe, restaurant and home use!  500g / 0.1g Mini Digital Spoon Kitchen Scale LCD Display Electric Measuring Tool
 
 Features:
 Guaranteed for craftsmanship and quality, durable enough for your da",audio_visual,2.70805020110221,2.1972245773362196
1385,alferns,omni wifi signal range extender antenna kit for dji phantom 3 standard wf11,36.0,1,1,Designed for DJI Phantom 3 Standard The antenna kits will extend the range up to 4 times the DJI rating Four Antenna Kit: Two customized high-gain 2.4GHz~2.591GHz 7dBi panels & 1 10dBi 5.8GHz omni antenna & 1 6 dBi 5.8GHz panel antenna with stand. More flying remote control distance means less chanc,others,3.6109179126442243,0.6931471805599453
1386,playforce,inspiron 3580 i7-8565u radeon 520 - dell inspiron 15 3580 i7-8565u radeon 520 8gb 256gb ssd,950.0,0,10,"Dell Inspiron 15 3580, 15-inch FHD i7-8565U, Radeon 520, 8GB, 256GB SSD  Details . Overall mint  . 1 month warranty  Includes . Laptop and charger  Specifications . Model: Inspiron 15 3580 . Operating: Windows 10 Home . Intel Core i7-8565U 4-Core 1.8GHz  . 8GB DDR4 Memory . 256GB NVMe SSD Storage . ",computers/parts,6.85751406254539,2.3978952727983707
1387,smarttrading,"jianhan usb c cable coiled 2 pack type c charger cable spring cord compatible with galaxy s10 s9 s8 macbook,huawei p20/mate 20/honor play/p10/p9/honor 8 xiaomi 5 and more, black",15.0,1,8,"✅FLEXIBLE COILED DESIGN:JianHan USB C Cable is specially designed by Spring wire,which can stretch and bounce to the length you need,easy to use for car charging and avoid to tangle free. ✅FAST CHARGING & DATA SYNC CABLE : Our type c cable uses 56K resistor definitely and premium internal pure coppe",keyboards/mouse/chargers,2.772588722239781,2.1972245773362196
1388,budgetsgbunny,kindle paperwhite,150.0,0,6,"great condition, rarely used thus selling.  4gb, wifi Daylight readable with built-in light Comes with charger, screen protector & kindle casing. ",others,5.017279836814924,1.9459101490553132
1389,rockyouout,focusrite solo 3rd gen audio interface,160.0,0,39,Refurbished and Tested Sets by Focusrite  Still comes with the same 1 year warranty from Focusrite  Limited Sets Left!,audio_visual,5.081404364984463,3.6888794541139363
1390,jfelite,【new】p9s cordless foldable stand fan floor / desk usb desk fan rechargeable6000mah battery portable,39.9,1,7,【NEW】P9S Cordless Foldable Stand Fan Floor / Desk USB Desk Fan Rechargeable 6000mAh Battery PortabLE  READY STOCK!  jfelite/remax/fan/usb,air,3.711130063048756,2.0794415416798357
1391,humji,"dell u2312hm 23"" 60hz monitor",80.0,0,7,Perfect condition. Upgraded to larger monitor. PM for pics or more info,audio_visual,4.394449154672439,2.0794415416798357
1392,tomato.sg,hot cable reel organizer / wire holder / cable management,3.9,1,3,"Buy 2 or more and get $0.2 off  Ready Stock Brand New Free Mailing (3-5 working days) Mail out on the same day as payment (excluding Fri and Sat)  Color Available: White, Black, Orange, Pink, Green Size: 67mm x 27mm  Can hold up to 5 Cables Sticky tape is provided at the back of the item for attachm",cables/adapters/switches,1.589235205116581,1.3862943611198906
1393,hwee3079,mavic pro pgytech lens filters g-uv nd4 8 16 32 cpl hd lens filter gimbal lens,52.0,1,3,Total 6 lens,others,3.970291913552122,1.3862943611198906
1394,shopaholicguy,eneloop pro rechargeable battery,40.0,1,8,New. Only one set  Self collect only.,remotes/batteries,3.713572066704308,2.1972245773362196
1395,ranaazharas,canon ixus 8x zoom full hd camera p17676 70 each,70.0,0,1,"Qty : 1pc ($70 Each) Can be power on but no further testing has been done. Comes with Memory card. Selling as it is. USED.   ""First Come  First Serve "". Unable to reply inquiries, Therefore, JUST WALK IN to check the condition and see 5000 other items at our warehouse  If you wanna buy something don",audio_visual,4.2626798770413155,0.6931471805599453
1396,parallelin,thinkpad p50 i7-6820hq,1088.0,0,6,"selling a used and well maintain unit of Thinkpad P50 with spec as follow: CPU : i7-6820HQ 2.7GHz RAM : 16GB (expandable to max 64GB) SSD : 2 x 512GB (1 m2 NVME and 1 SATA, have one more m2 slot with adapter) Display Adapter : NVIDIA Quadro M2000M Screen : FHD (1920x1080) Wwan : 3G express card  no ",computers/parts,6.9930151229329605,1.9459101490553132
1397,terencetanwt,macbook pro 15 inch 2018 top spec,3499.0,0,9,"Macbook Pro 15 inch 2018 Model, maximum configuration (less SSD).
 
 Customised Top Specs:
 ✅ Intel i9-8950HK CPU (2.9 - 4.8Ghz)
 ✅ 1TB NVMe SSD
 ✅ 32GB RAM
 ✅ AMD Radeon Pro 560X 4GB VRAM
 ✅ AppleCare till July 2021
 
 Reason for selling: I need more storage and RAM for my current workflow.",computers/parts,8.160518247477505,2.302585092994046
1398,playforce,macbook pro 2018 16gb 512gb - apple macbook pro 2018 13 touch bar i5 16gb 512gb space grey,2399.0,0,14,"Apple Macbook Pro 2018, 13-inch touch bar i5 2.3GHz, 16GB, 512GB SSD, Space Grey  Retail . $2,878.00 + $280 (16GB) + $348 (AppleCare)  Details . Overall mint condition . AppleCare warranty till: Mar 2022 . Verifiable via Apple's web  Includes . Box and manual . Laptop & Charger  Specifications . Mod",computers/parts,7.783224016336037,2.70805020110221
1399,centumdigital,"same day delivery refurbished dell latitude e7270 e7470 12.5"" 14"" inch core i5 / 8gb / 256gb ssd / win10 pro notebook laptop extended warranty up to 24 months",499.0,0,24,"Refurbished Grade A Set (Tip Top Condition)
 2 Months Warranty
 1.2kg
 Free Laptop Bag and Mouse
 
 Dell Latitude E7270 Core i5-6300U / 8GB  DDR4 / 256GB SSD / Win10 Pro - $499
 Dell Latitude E7270 Core i5-6300U / 16GB  DDR4 / 256GB SSD / Win10 Pro - $559
 Dell Latitude E7470 Core i5-6600U / 8GB  DD",computers/parts,6.214608098422191,3.2188758248682006
1400,casterlylaptops,razer rz09 0301 i7 9750h/16gb ram/256gb ssd/rtx 2070,2399.0,1,3,Blade 15 Ips 1920 x 1080  Rgb keyboard  1 month in house warranty,others,7.783224016336037,1.3862943611198906
1401,techmaniac,macbook pro 13” 2015 retina,980.0,0,8,"Very underused MacBook Pro 13” (Early 2015) version.   - Great interior condition - Exterior condition: no scratches except for a dent on the side of the MacBook unibody. See picture 3. The dent doesn’t affect MacBook usability, only cosmetically.   Bought in June 2015. Never replaced/repaired befor",computers/parts,6.8885724595653635,2.1972245773362196
1402,leinfotech,hp elitedesk 800 g1 desktop / small form factor pc /intel i7-47703.4ghz /16gb ram/ new 240gb ssd /nvidia 600 1gb,468.0,0,13,"Used Item, Tested 100% Working
 Buyers are responsible to return our warehouse for any return or warranty claims
 One Month Warranty 1 to 1 Replacement
 Processor: Intel i7-4770 4th Gen CPU, #3.4Ghz
 Memory: 16GB DDR3 RAM
 Hard Drive: New 240GB SSD
 Graphics:Nvidia Quadro 600 1GB GPU for photoshop e",computers/parts,6.150602768446279,2.6390573296152584
1403,joycelovecloset,macbook pro retina 13-inch 2014 mid ram16gb ssd500gb intel core i5 high spec apple full box like very new,1155.0,0,4,"Apple MacBook Pro Retina 13 inch Mid 2014  Highest Spec in it range , Ram 16GB , SSD 500 GB , Intel Core i5 .  Full Box Set with Original Apple MagSafe 2 power Adapter.  Ultimate tip top condition 9.9/10 no scratch no dent, Very New, View to appreciate.  Interested please click chat to contact me.  ",computers/parts,7.052721049232323,1.6094379124341003
1404,jfin.sg,"bnib lenovo 14"" hd touchscreen/convertible/amd/4 gb ram/128 gb ssd/2-in-1 laptop/win 10s/699",699.0,1,41,"FEATURES:  * High Performance Laptop-cum-tablet: The Flex 14 laptop is equipped with AMD Ryzen 3 2200U Processor, Windows 10, 4GB DDR4, 128GB PCIe SSD and so much more.   * Multi-mode: Classic Laptop Mode for maximum productivity, Stand mode for an Optimal Touch Experience, Tent Mode for Gaming & En",others,6.551080335043404,3.7376696182833684
1405,xtremesolution,ducky one 2 white editon keyboard - full size / tkl size white led only,169.0,1,3,Ducky One 2 White Editon Keyboard (White LED only) Available in Full Size / TKL Size only  TKL Size - Brown switches only Full size - Red / Speed switches only  For more information: https://www.duckychannel.com.tw/en/Ducky-One2-White-Edition  For more information: https://www.duckychannel.com.tw/en,keyboards/mouse/chargers,5.135798437050262,1.3862943611198906
1406,tabbybib,canon pixma ink bk 751 xl,15.0,1,1,Computer Parts & Accessories,printers,2.772588722239781,0.6931471805599453
1407,casterlylaptops,razer rz09 0286 i7 8750h/16gb ram/512gb ssd/rtx2060,2099.0,1,5,Ips 1920 x 1080 Rgb keyboard  1 month in house warranty,others,7.649692623711514,1.791759469228055
1408,fishc8ke,garmin fenix 5x plus,600.0,0,14,"9 months old Fenix 5X Plus for sale. Local set, receipt lost. warranty status can be verified by garmin repair center url. Full box and accessories.  condition is 9/10, slight hairline scratch on top of bezel.",others,6.398594934535208,2.70805020110221
1409,gnraly.dealer1,airpods 2,100.0,1,85,"🌈Features  🌟Name change ! 🌟GPS buds tracking! 🌟Find my airpods! 🌟 Wireless charging! 🌟 Serial number!  🌟Anti - close lid ( see last pic )  Small detail people miss out ^   🗿Ehy bro why so cheap!? 🍂 Airpods pro just got released and l just happen to got hold of the airpods 2 stock . Well lucky YOU , ",audio_visual,4.61512051684126,4.454347296253507
1410,dukesong666,hifiman re800 unbelievable iem,500.0,0,20,"HIFIMAN RE800 in mint condition！  No need to introduce or describe them too much because they are so well known and you Google it and can easily find its reviews.  Condition: 10/10. Full box set. No warranty (actually if you are willing to send it directly to China for repairing, the warranty is unt",audio_visual,6.2166061010848646,3.044522437723423
1411,bkywl,fitbit inspire hr,98.0,1,12,Used once but doesn't suit my needs.  Mint condition.,others,4.59511985013459,2.5649493574615367
1412,tanswf,andyson power supply f550 550watts for desktop pc,60.0,1,10,"New AndySon Power Supply F550 550 Watts 1 Year Carry In Warranty Valid, interested please email me at HP 81757045 / support@ezworld.com.sg Ex-Stock status",computers/parts,4.110873864173311,2.3978952727983707
1413,itc_adm,"asus 12"" slim & lightweight laptop + ms office only 100",100.0,0,32,Please whatsapp if possible as I’m having issue in opening some Carousell message for days.   Contact number: 8500 0092  You may also click to directly whatsapp at this link: wa.me/6585000092   Used Asus 12 inch Slim & Light Weight Laptop + Windows 10 Professional + Microsoft Office (full version) +,computers/parts,4.61512051684126,3.4965075614664802
1414,t258jgn,"read descriptions tecware exo elite gaming mouse, pixart 3389 sensor, 16000dpi, 69gm black",40.0,1,46,"Tecware EXO ELITE Gaming Mouse, PixArt 3389 Sensor, 16000DPI, 69g BLACK 
 
 Product Specifications: https://www.tecware.co/exo 
 
 
 Tecware Haste XXL Mousepad ROUGH SURFACE @ $16
 Stitched Edge
 900x300x3mm
 Water Resistance Surface 
 ROUGH SURFACE  
 Product Specifications: https://www.tecware.co/",others,3.713572066704308,3.8501476017100584
1415,fatbudgetboy,"6898 yosoan modern led ceiling spotlight 3 way ceiling lights for mall, kitchen, living room, bed room, dining room antique",32.0,1,4,"#6898 damaged box  -Please note that the normal shipping time is 3-5 days, system shows in error -Adjustable 3 way spotlights -Ceiling rose : 38cm/15” (length) -Bulb type: GU10 (Not include),Max Wattage: 40 Watts -Suitable for Mall,Kitchen, Living room, Bed room, Dining room etc  LOW BALLER WILL BE ",lights,3.4965075614664802,1.6094379124341003
1416,eh_movers,walkie talkie,15.0,1,8,interested pls call hp 97403113,others,2.772588722239781,2.1972245773362196
1417,djyang,corsair k70 rapidfire,75.0,0,4,Selling a very well taken care off Corsair K70 rapidfire gaming keyboard. Selling because I seldom game ever since I started working. All keys in perfect working condition.   Condition: 9.5/10  Comes with full box and accessories.   Free delivery to your doorstep,computers/parts,4.330733340286331,1.6094379124341003
1418,gitzaii,parblo coast 13 pen display graphics monitor,149.0,0,11,"Selling my Parblo drawing tablet monitor  Working perfectly  13 inch monitor Comes with a pen Replacement nibs Charging kit  This is the exact same tablet as this review, Please read the post first. https://www.parkablogs.com/content/review-parblo-coast13-pen-display-graphics-monitor https://youtu.b",audio_visual,5.0106352940962555,2.4849066497880004
1419,rollandgoh,monitor,85.0,1,54,ACER LED MONITOR 19.5'' MODEL V206HQL,audio_visual,4.454347296253507,4.007333185232471
1420,shiershao,sensonic headphone & webcam,20.0,1,3,Brand new for 3 Selling 3 as bundle,audio_visual,3.044522437723423,1.3862943611198906
1421,hlyx.,texas instruments ti-84 plus ce graphic calculator,135.0,0,2,"Fully functional, some slight scratches on the back over.   1 year old condition 9.5/10  Bought for $180  comes with charger and instruction manual      tags: acjc ejc hci ri pjc jjc jpjc ijc njc nygc",computers/parts,4.912654885736052,1.0986122886681098
1422,gooppwr,klotz lagrange gy107 low capacitance instrument cable,35.0,0,2,"2 length, each length 0.93 meter Know among those into Hi Fi to be affordable and yet good performance cable",cables/adapters/switches,3.58351893845611,1.0986122886681098
1423,theavantgardeconcept,"27"" 144hz qhd monitor",405.0,1,21,"27 inches curved monitor! together with 144hz which is optimal for gaming! Large screen for better productivity! QHD resolution (2K), great as an editing monitor as well! Looks great with its slim bezel design and clean design! stand comes with a cable management clip to keep your desk neat and tidy",audio_visual,6.0063531596017325,3.091042453358316
1424,hlyx.,imported webcam,45.0,1,2,"Ready stock, can collect ANYTIME FAST  ✔️ Plug and play (easy installation, just plug USB into device that's it!)  ✔️ Able to switch on LED light for extra exposure  ✔️ Superior low light performance, auto correction  ✔️ High definition 720p/1080p ✔️Adjustable focus  ✔️USB 2.0 ✔️Suitable for windows",audio_visual,3.828641396489095,1.0986122886681098
1425,swordfish1889,1st player power supply unit 600w,50.0,1,18,Brand new not used. Bought two by mistake  ,audio_visual,3.9318256327243257,2.9444389791664403
1426,shirlynnn,nakamichi lsx03 suprano lifestyle bluetooth speak,100.0,1,3,Nakamichi LSX03 Suprano Lifestyle Bluetooth Speaker Color:Brown Bluetooth 10h battery life Weight:660g Size: 208x85x80mm Brand new! Got it as a gift.  UP$230+,others,4.61512051684126,1.3862943611198906
1427,academ,hp deskjet 2130 all-in-one printer,60.0,1,3,BNIB wired HP printer with both blank and tricolour ink included in box. Left with 3 qty  Add additional HP tricolour ink at $20 with printer or $22 separately.  Self collection at Hougang Green Shopping Mall or 530567. Additional $2 applies for meetup at Hougang mrt station.,printers,4.110873864173311,1.3862943611198906
1428,edschia,bang & olufsen wireless earphones,100.0,1,3,Brand new set  with seals intact.   B&O wireless earphones with adjustable ear hook wearing style.   Price includes delivery. ,audio_visual,4.61512051684126,1.3862943611198906
1429,marcgadget89,"a021 charging stand 3 in 1 for iphone x 8 7 silicone, charging stand, base station for apple watch airpods",25.0,1,2,"Self collect at 11 woodlands close #04-08 (S)737853 Please inform before coming down  Direction:  Take Bus 901M from Admiralty Mrt and 2 Busstop.   Courier will be $5. Will delivered within 3 days  ✅ Please kindly read through the description of product given. (Items are exact to picture listed, unl",keyboards/mouse/chargers,3.258096538021482,1.0986122886681098
1430,huayu92345,apple airpods 2,180.0,1,53,Apple AirPod 2 (Brand New) ✔️ Can change name  ✔️ GPS Tracking ✔️ Authenticated Serial Number ✔️ In House Warranty ,audio_visual,5.198497031265826,3.9889840465642745
1431,jfelite2020,remax tws-7 true wireless ear buds bluetooth v5.0 earphone tws 7 ear pods with touch control – simple goods,29.9,1,5,"REMAX TWS-7 True Wireless Ear Buds Bluetooth V5.0 Earphone TWS 7 Ear Pods With Touch Control  SPECIAL OFFER  $29.9 ONLY COME WITH LOCAL WARRANTY  REMAX TWS-7 – White Colour True Wireless Ear Buds Bluetooth V5.0 / A2DP, AVRCP, HFP, HSP Smart touch control Music play time : up to 4H Call time : up to ",audio_visual,3.4307561839036995,1.791759469228055
1432,junteo_10,black paper shredder - max 8 sheets,35.0,0,3,"Aurora AS800CD Black Colour  Can shred CDs and Credit Cards  Full Description -  Cross Cut, Designed for home and office use. - Sheet Capacity: 8 sheets - Shred Size: 5X47MM - Shred CDs and Cards - Duty Cycle: 2 Min On / 30 Min Off - Safety Interlock automatically shuts shredder off when waste bin i",others,3.58351893845611,1.3862943611198906
1433,thefirstcotton,epson l365 printer,150.0,0,16,"Multi-function Wi-Fi printer with integrated ink tanks for fast and cost-effective colour printing, copying and scanning",printers,5.017279836814924,2.833213344056216
1434,average_tech_guy,"next day all brands, types canon/hp/brother/epson brand new in box printer ink cartridges/bottles/toners for work from home cheap bundles 740 740xl 741 741 xl 745 745xl 746 746xl 61 62 63 64 65",0.0,1,25,"NEXT DAY DELIVERY AT $4 ON SELECTED ITEMS, OR GET FULL REFUND!*  (details below)  Below are the availabilities of popular models.  Our items are Brand New in Box and 100% Authentic. WILL QUOTE DISCOUNTED PRICE FOR BUNDLES!  POPULAR MODELS: Canon PIXMA 740/741/745/746: https://sg.carousell.com/p/1006",printers,0.0,3.258096538021482
1435,reynodlam,"dell xps 15 7390 4k, i9, 2tb ssd, 64gb ram warranty until jan 2021",3999.0,0,22,Sales! DELL XPS 15 7390 Condition 99% New (used only 3 months+) Warranty until 27 Jan 2021 (Premium on-site warranty service) i9-9980HK 15.6’ 4K OLED non-reflective screen (3840 x 2160 pixels) 64GB RAM 2TB SSD Nvidia GeForce GTX 1650 4GB 1.8kg (Original Price: S$5499) ,computers/parts,8.294049640102028,3.1354942159291497
1436,rcpag1103,qualcomm dw1820 wifi card,15.0,0,3,Taken from my old laptop what you see is what you get Dual band,computers/parts,2.772588722239781,1.3862943611198906
1437,vibegoodss,"bluboon 5"" mini desk fans usb powered small table fan 2 speeds personal fan for laptop/notebook/home/office metal, quietness, black",12.0,1,16,"https://www.amazon.co.uk/BLUBOON-Powered-Personal-Notebook-Quietness/dp/B01EEVOB5U   This mini USB fan is 5"" blade, size 7.0*4.1*6.3inch, take little space, nice choice for home/office desk Small desk fan powered by a 1.2m USB cable, convenient to connect with your computer, laptop, notebook, DC 5V ",air,2.5649493574615367,2.833213344056216
1438,yung81,3m privacy filter pfcmm001 25.7 x 14.4cm,29.0,1,1,"Brand new unused. Bought for spare.  Meant for 11"" Chrome book but should be compatible with other similar size laptop or tablet of 11.6"" wide.",others,3.4011973816621555,0.6931471805599453
1439,cablesaga,hdmi to vga,7.0,1,75,HDMI to VGA converter adatper cable.  Good for converting laptop with HDMI output to VGA  +$1 for Postage,others,2.0794415416798357,4.330733340286331
1440,goodstuffsg,plextone pc780 gaming headphones led bass headset with mic,22.0,1,17,"Free delivery via standard EXPRESS mail Color: Black Red,Black Blue,White Blue USB plug provides power for the LED lights The other two 3.5mm plugs (1 Mic plug and 1 Audio plug) also need to be connected to the computer to have sound  Stock is available in overseas warehouse, immediate call for ship",audio_visual,3.1354942159291497,2.8903717578961645
1441,theavantgardeconcept,"24"" 144hz fhd curved monitor",258.0,1,79,"24 inches curved monitor! together with 144hz which is optimal for gaming! 1920x1080 Resolution   Comes with DP, DVI and HDMI ports  Similar manufacturer as PRISM Displays   Add on another $5 for plug adapter   Ships out in may! (order closes 3rd May)  Required to pay a 40% deposit before ordering  ",audio_visual,5.556828061699537,4.382026634673881
1442,gamingspecialist,"12d 6072 new enacfire bluetooth 5.0 wireless headphones, future plus bluetooth headphones",48.0,1,5,"💬 CHAT TO BUY WHEN YOU HAVE DECIDED ON PURCHASE.  -SELF COLLECTION/ REGISTERED DELIVERY ONLY. (Please arrange with us before coming, as item might not be available.)  ✅ Please kindly read through the description of product given. (Items are exact to picture listed, unless otherwise stated)   PS. I w",audio_visual,3.8918202981106265,1.791759469228055
1443,chenshangyu,i5 7400/8gb/120gb ssd,370.0,0,4,"Most parts are new or pretty new Case: Aftershock bolt mid tower, with tampered glass, 5 fans, bnib CPU: I5 7400  MOBO: Asus H110M-A/M.2 (M.2 pcie 2.0 supported) GPU:  AMD HD 6950 RAM: DDR4 8GB (2 * 4GB) 2666MHZ Storage: ADATA 120GB (new with box) PSU: Cooler Master 500w Windows 10 pro, office could",computers/parts,5.916202062607435,1.6094379124341003
1444,fatboyauction9672,"soundpeats truecapsule wireless earbuds tws bluetooth earphones in-ear mono/stereo bluetooth 5.0 earbuds wireless headphones with upgraded microphone smart touch, ipx5, 24 hours playtime",36.0,1,21,"PLEASE NOTE BEFORE BUYING: 1. Our warranty covers locally 7 days any issue (spoilt, not working) = refund or exchange no question asked. 2. We do not offer warranty for cosmetic defects (dents, small scratches etc.). 3. All our products are QCed and its original packaging may be damaged or not perfe",audio_visual,3.6109179126442243,3.091042453358316
1445,limyiqian,yamaha 3-way bass-reflex tower speaker system in good condition,700.0,0,20,"3-Way Bass-Reflex Tower Speaker System. The EF (Elliptical Form) Series feature Waveguide horns, PMD (Polymer-injected Mica Diaphragm) woofers and highest quality internal Monster Cable wiring for total enjoyment of digital movie sound and music sources, plus elegant Yamaha traditional piano finish ",audio_visual,6.55250788703459,3.044522437723423
1446,lalalalaashd,"microsoft surface pro 3 with dbrand skin intel i7, 8gb ram, 512gb ssd, windows 10 pro touch screen with screen protector laptop tablet comes with two keyboards",525.0,0,56,"Selling my beloved surface cuz no longer using 😢 comes with type c to surface connector, third party Microsoft pen protocol certified pen, charger and d brand skin. Trade in is welcomed (gaming laptop?)   Touch screen - works perfectly fine & comes with a screen protector  Keyboard - works greats bu",tablets/phones,6.26530121273771,4.04305126783455
1447,tckoo1411,"wecube st2770 led ips 27"" 2k monitor",210.0,0,11,"Have a set of Korea ips 2k monitor for sale. Does 2560 x 1440 resolution. 4 inputs for video, Dual link dvi, vga, rgb and hdmi. 1 Audio in and 1 out. Brand is wecube, model is ST2770. Comes with dual link dvi cable, stand and power adaptor. 27"" and uses lg ips panel. In good working condition.  http",audio_visual,5.351858133476067,2.4849066497880004
1448,cheapdonger,samsung galaxy buds sm-r170 wireless in-ear headset bluetooth earphones,30.0,1,12,Brand new only open the box to test the buds. Noted its not the real buds. Fixed Price,audio_visual,3.4339872044851463,2.5649493574615367
1449,all.gadgets,"solar garden lights, 60 led outdoor string lights crystal ball fairy lights solar powered 30ft waterproof decorative lighting for garden, patio, yard, home, christmas energy class a++ - warm white",30.0,1,2,"Features & details  【60 SUPER BRIGHT LED LIGHTS】The transparent crystal ball design of 60 led, make this solar Fairy lights brighter and versatile. This solar string lights built-in 1.2V 800mAh rechargeable Ni-MH battery, with higher energy conversion rate, charging the light during the day for 4-6 ",lights,3.4339872044851463,1.0986122886681098
1450,soar.universe,usb rechargeable speaker bicycle waterproof bicycle light,21.0,1,4,"Speaker Bicycle Headlight Bike Front Light 5W 300 Lumens USB Rechargeable Double Led Beads Lamp with Horn   Main Features: FUNCTIONAL DESIGN. It is a bicycle headlight, also a horn. One device, two functions, integrated by one controller made of silicon rubber. GREAT PERFORMANCE. The maximum decibel",lights,3.091042453358316,1.6094379124341003
