,Seller,Product,Price,Quality,Likes,Comments,Category,Log Price,Log Likes
688,music_maker,mini drill grinder accessories compatible with dremel,16.99,1,46,Come with compartment plastic tool box,others,2.8898160479624417,3.8501476017100584
689,akarkyaw,asus rog cg8565 gaming pc + samsung monitor,650.0,0,32,"ASUS ROG CG8565 + Samsung Monitor   ASUS ROG CG8565 Spec: - Intel core i7-2600K @3.4 Ghz - 8Gb RAM  - 256Gb SSD + 1 TB HDD - Nvidia GeForce GTX 750 Ti (upgraded not long ago) - Windows 7  - External condition: 8/10  - Internal condition: 10/10  Able to play Dota2, CSGO @ 100+ FPS   Present for you..",audio_visual,6.478509642208569,3.4965075614664802
690,lim9800,yamaha soundbar ysp1400 5.1ch digital projector sound bar with built-in subwoofer,240.0,0,5,Yamaha YSP1400 5.1CH Digital Projector Soundbar with Built-In Subwoofer.  Experience precision audio sound quality with superior sonic bass performance.  Excellent original condition.   Overall condition 10/10 Original Remote  New Optical Audio Cable,audio_visual,5.484796933490655,1.791759469228055
691,thegadgetstall,depstech wireless endoscope,15.0,1,3,What you see is what you get    Additional courier $5,others,2.772588722239781,1.3862943611198906
692,cmsittrading,xps 13 4k 2020,2399.0,1,14,"10th Generation Intel® Core™ i7 10710U Processor 13.3"" 4K Ultra HD (3840 x 2160) Infinity Edge Touch Windows 10 Home (64bit) English 16GB RAM  512B M.2 SSD  Intel® UHD Graphics with shared graphics memory 2Yr Premium Support: Onsite Service",computers/parts,7.783224016336037,2.70805020110221
693,just_sharing_sally,2974mbps wifi card ax200 802.11ac/ax 5,36.0,1,7,"Here to share the link to the item :D
 Link to more information and the WiFi card:
 https://shopee.sg/Dual-Band-PCI-Express-WiFi-Card-Gigabit-for-Intel-AX200-2.4G-5Ghz-802.11Ac-Ax-5.-i.192710510.7717903610
 
 okay I listed this before and im gonna do it again AHAHHA. really nice value on some pretty",computers/parts,3.6109179126442243,2.0794415416798357
694,onlyqmall,huion h430p digital tablets osu game tablet signature graphics drawing pen,50.0,1,40,"✨ [Pre Order] PRODUCT ✨
 ⌚ Receive parcel within 10 days 
 🚚 Postage: 🆓 Free by courier/singpost
 🈹 Discount $2 for 2pcs/sets onward 
 ✅ All product warranty 2 days,If have issue can be refund.
 ❌ No Cash On Delivery, No Viewing, No Exchange.
 
 🌹🌹🛒 TO ORDER 🛒🌹🌹
 
 Orders will only be process ASAP o",tablets/phones,3.9318256327243257,3.713572066704308
695,winning_infinity,cny flash⚡️ sales 🔥brand new- 👍🏻ldnio- 2 in 1 power socket + usb plug / fast charge power socket/ extension socket,20.0,1,59,"🔥Products is Brand new come with packaging Box!! 🔥For more details about this products information please refer to last picture.  🔥Limited stock only !! Hurry up!! Ask me anything about this products 😊  Doubt my products quality & genuine?  Feel free PM me for more details, Or take a look my feedbac",cables/adapters/switches,3.044522437723423,4.0943445622221
696,yiquntec,"hp, canon, epson ink cartridge new stock",34.5,1,36,"HP, Canon, Epson ink cartridge new stock  Brand New; Different price for different model. Pls Check our profiles, or contact with our staff.  - Please show this carousell page to our staff for Offer Price; - Local Pick up, Fix Price, Cash Only;  - Recommend shop collect. ============================",printers,3.56953269648137,3.6109179126442243
697,rk.sg,new high quality cat 7 ethernet cable,6.0,1,31,* Highly Recommended.  * Excellent internal wiring (High Quality Controlled)  * Black color won't turn yellowish over time * Stock available locally  * Free delivery via normal mail (send out immediately) * Tracked mail or meet up options available too  * Available Stock 0.5m @ S$6.00 only (Restocke,cables/adapters/switches,1.9459101490553132,3.4657359027997265
698,karen_ng25,"apple watch nike series 5 gps, 44mm space grey aluminium case with anthracite/black nike sport band - s/m",700.0,1,3,Brand new.   Chat me if you are interested. ,covers/cases,6.55250788703459,1.3862943611198906
699,ridzmotor,akg earpiece authentic,10.0,1,7,-Akg AUTHENTIC ear piece  -BRAND NEW STOCKS HAVE ARRIVED  -cheapest in carousel -comes with free (sized earbuds) -slef-collect,audio_visual,2.3978952727983707,2.0794415416798357
700,yes7606,toyota sewing machine ,188.0,1,12,Brand :TOYOTA Model :ECO15A,others,5.241747015059643,2.5649493574615367
701,hs00050,gocheer professional airbrush kit,89.0,1,4,"The popular Gocheer usb charging airbrush on YouTube! We appreciate your trust in Gocheer professional airbrush and hope you will be happy via using this portable airbrush apply to cake decoration,make up,nails design,Tattoo,model painting,Red  Spray & Maintenance Method：How to spray: FIRST STEP: In",others,4.499809670330265,1.6094379124341003
702,premium.affordable,display4top portable single-action airbrush gun with mini airbrush air compressor kit,50.0,1,5,"•	Multi-purpose precision gravity feed airbrush with a 0.3 mm needle/nozzle gravity fluid cup  •	360 degree airbrush holder for your convenient use of airbrush. Quite and durable mini air compressor, portable light weight and easy to carry around   •	Pro gravity feed airbrush kit for hobby paint cra",others,3.9318256327243257,1.791759469228055
703,jhea25,"wood grain wireless charger qi 10w fast charging pad stand compatible with apple iphone xs max xr x 8 plus, samsung galaxy s9 plus s8 plus s7 s6 edge note 9, huawei mate 20 pro and more",20.0,1,7,"【Wood Grain & Sailboat Shape Design】With its minimalist and elegant wood grain design, it blends seamlessly with any wooden furniture to enhance the appeal of your surroundings.Sailboat shape,sleek attractive design and easy to use in multiple locations such as home bedroom nightstand, office desk, ",keyboards/mouse/chargers,3.044522437723423,2.0794415416798357
704,dearbluesky,digital tv box and antenna,50.0,0,9,New Digital TV Antenna and a used a new Media Solutions Digital TV box,audio_visual,3.9318256327243257,2.302585092994046
705,matrix11,linkstation pro duo nas,100.0,0,20,NAS comes with 2 X 1GB HDD,others,4.61512051684126,3.044522437723423
706,cheesefishball,"hp elitebook 830 g5 i5, 13”",600.0,0,4,"Excellent condition. 10/10  Just computer and charger, no box.  Warranty verifiable via HP.",computers/parts,6.398594934535208,1.6094379124341003
707,heavencarts_husnaretail,alquran digital po,79.0,1,29,AL-QURAN DIGITAL AL-FALAH (PREORDER)  Free Gifts : 1 ) Al Falah Gold Woven Bag 2 ) Tasbih Digital 3 ) Sejadah Travel Al-Falah  PAKEJ PRODUK: 1) Al-Quran Mushaf Uthmani Bersaiz A5 2) Pen Pembaca Digital 4GB / 8GB 3) Buku Qaida Noorania (Kaedah Membaca Al-Quran) 4) Buku Talking Dictionary (14 Bahasa A,others,4.382026634673881,3.4011973816621555
708,littlestorz,banana – y adapter / converter,3.0,1,16,To convert 4mm banana plug to Y Connector. Y connector inner 6mm  Selling at $3 /pcs Selling Pack of 8 @$20 (Save $4),cables/adapters/switches,1.3862943611198906,2.833213344056216
709,riotcoke,apple watch series 4 stainless steel 44mm discontinued,588.0,0,6,Looking for Stainless Steel model Apple Watch but find it too expensive? Look no further. Here is a Series 4 Stainless Steel model which Apple is no longer selling!! Case: Original stainless steel Size: 44mm Cosmetic Condition: 9.5/10 Working Condition: 10/10 Price comes with milanese and leather st,time,6.3784261836515865,1.9459101490553132
710,punggoldealz,sale bn naipo seat cushion with ventilated & heating pad,45.0,1,5,"Features & details  【Pleasant ventilation function】 The pillow ventilation function through the air flow, which dries excessive heat and moisture from your back and hips, freeing you from sweat. Seat Cushion is perfect for 12V Car and van, home and office use  【Adjustable heating and ventilation fun",others,3.828641396489095,1.791759469228055
711,fluffyfoodiecafe,smoovejet 6-blade usb rechargeable portable power blender oem,19.9,1,40,"With the new SmooveJet 6-blade USB rechargeable portable power blender, now you can have the freedom of blending your favourite shakes, nutritional drinks, smoothies, and baby food any time, wherever you are!  SmooveJet portable blender is powered by a motor which has an incredible speed of 22000rev",others,3.039749158970765,3.713572066704308
712,hotcpu,lenovo desktop 50 for sell,50.0,0,42,Sell Lenovo desktop computer Can used for office  Homework  Youtube   Win 7 os Cpu: E7100  core 2 Ram:2GB HDD:80 GB DVD room  Win7 os  Let me know if you want  Thanks . ,computers/parts,3.9318256327243257,3.7612001156935624
713,meruchan,new mini refrigerator only warm,50.0,1,3,I bought this from Qoo10 to store my skin care but the cold function is not working. And  I can’t be bothered to return this during CB. So I’m selling it here to those who needs a mini fridge to keep things warm.  So only warm function is available for this fridge. 60-65 Celsius   Can use for  -  he,others,3.9318256327243257,1.3862943611198906
714,ilvdeal,apple magic mouse,50.0,0,6,Box misplaced. Good condition,keyboards/mouse/chargers,3.9318256327243257,1.9459101490553132
715,toysandguns,dji spark drone flymore combo with filter lense,360.0,0,17,Super great condition spark set 1x DJI spark drone with propellers 2x batteries  1x controller  1x charger set  1 x 4 piece propeller set brand new  1x 4 piece propeller Guard set  1 x manual set 1x DJI BAG (no sling)  1x DJI foam box  1x SPARK set sling bag with handle carry(3rd party) ,others,5.8888779583328805,2.8903717578961645
716,cashconverterssg,wifi smart socket,5.0,1,3,BUY THIS ITEM AT OUR WEBSITE AT  USE VOUCHER CODE : CB10OFF TO GET 10% DISCOUNT WITH NO MINIMUM SPENDING REQUIRED.  URL: https://www.cashconverters.sg/smart-plug-6800000070437.html,cables/adapters/switches,1.791759469228055,1.3862943611198906
717,gamingspecialist,5d 4635 new olixar for iphone 11 pro tough case - with 26 in 1 survival multi tool - protective armour cover - credit card slot & built in stand - x-ranger - black,21.99,1,4,"Retail Price: $27.99 🔥 Buy from us & you save up to 20% 🔥  ✅ Please kindly read through the description of product given. (Items are exact to picture listed, unless otherwise stated)  ✅ Address and opening hours are stated on every page listing  (End of the page of Meet up/ Mailing tab).  💬 CHAT TO ",covers/cases,3.1350593387750902,1.6094379124341003
718,snuglucks,"lenovo x1  carbon gen 1 / i5 3427u / 8gb ram / 14"" screen / 256 gb ssd / fingerprint reader",450.0,0,53,"Condition: Very Good. Minor Scratches (refer to photos). Working like new.  Warranty: No Warranty  Charger and laptop bag included  Specifications: OS: Windows 10 Pro Processor: 3rd Generation Intel Core i5-3427U (2.80 GHz, 3MB L3 Cache, 1333MHz FSB) Battery: 45Wh, Integrated, RapidCharge up to 80% ",computers/parts,6.111467339502679,3.9889840465642745
719,ann2020,samsung ht-h7500,88.0,0,9,"Samsung HT-H7500 home theater surround speakers set for sale ONLY   But I will Includes  - AV Head unit in 5th picture (for free) need repair - main power on off by itself,  otherwise the others function works just fine.  Good for those who knows how to repair.....   Pretty expensive set bought near",others,4.48863636973214,2.302585092994046
720,jomosell.sg,promo bose sound link revolve + plus brand new and sealed,360.0,1,137,"Introducing the Soundlink Revolve Plus - the bigger brother of the popular Bose Revolve.  Retail Price: $459 PROMO SPECIAL: $360 (total savings of $99!)  **Happy to price match where possible.   Black or Silver.   Once bought, please prepare yourself to be the party hero! ;)    We recommend you go t",audio_visual,5.8888779583328805,4.927253685157205
721,mamuchachi,zotac gtx 1660 super amp edition oc,330.0,0,2,price negotiable amp edition comes with a beefier backplate and comes factory overclocked out of the box can run up to 2040mhz lightly used for 2 months  condition 10/10 selling due to upgraded GPU so I have no use for this comes with box and all the included hardware have local warrenty (4 years 10,computers/parts,5.802118375377063,1.0986122886681098
722,loyisneasyn,hp deskjet 3630 ink printer,30.0,0,6,"Used once only  Put aside for more than a year, think ink needed replace   Like new and working condition(just tested to turn on and still working)  Self collect at my place (Toa Payoh area)",printers,3.4339872044851463,1.9459101490553132
723,pcnstuff,acer aspire e5-473 series n15c1,300.0,0,14,i7-5500U 8GB RAM 500GB HDD  All new Windows 10 installed.  Charger and laptop bag included.  Under utilized as I have a few laptops already.,computers/parts,5.707110264748875,2.70805020110221
724,amazing.gadgets,"ab234 portable air cooler, mobile cooling air conditioner with usb, 3 in 1 mini mobile personal space cooler air ultra, humidifier, purifier desktop cooling fan for office",30.0,1,9,"Low energy consumption air cooler
 
 Product information
 Package Dimensions	8.2 x 8 x 7.7 inches
 Item Weight	1.7 pounds",air,3.4339872044851463,2.302585092994046
725,flyhighwithme,tp link wireless router,25.0,0,1,Used but in good condition Comes with installation guide and box ,others,3.258096538021482,0.6931471805599453
726,live_and_let_live,foot spa bath massager,80.0,1,1,"Brand new.  4.4 out of 5 stars  307 Reviews Foot Spa/Bath Massager with Bubbles and Lights, Arealer Foot Bath Massager with Automatic Massaging Rollers, Relieve Foot Pressure with 6 in 1 Function  https://www.amazon.com/Arealer-Massager-Automatic-Temperature-Electric/dp/B07FYY63FB",others,4.394449154672439,0.6931471805599453
727,joanng8,corsair vengeance 8gb 1600mhz ram,100.0,0,5,Computer Parts & Accessories,computers/parts,4.61512051684126,1.791759469228055
728,annacaroliiina,bodyfat scale,20.0,0,1,"Measures body weight, bone mass, water etc. Different slots for different household members. kG and lb possible to program. ",others,3.044522437723423,0.6931471805599453
729,shoufuu,sennheiser hd6xx headphones,375.0,1,13,"BRAND NEW IN BOX   Specs: Color: Midnight blue Transducer principle: Open, dynamic Frequency response: 10 Hz – 41 kHz THD: < 0.05% Nominal impedance: 300 ohm Cable length: 6 ft (1.8 m) Connector: ⅛ in (3.5 mm) Weight without cable: 9.2 oz (260 g) Made in Romania   2 Years warranty included No Negoti",audio_visual,5.929589143389895,2.6390573296152584
730,fatbudgetboy,6828 official ps4  wired chat headset - black/blue,25.0,1,7,#6828 slightly dented box  Officially Licensed Product Traditional overhead design with boom microphone and padded on-ear speaker Fully compatible with PS4 chat enabled games Easy to use mute control  LOW BALLER WILL BE IGNORED  FIRST COME FIRST SERVE BASIS *We do not accept caroupay* Self Collectio,audio_visual,3.258096538021482,2.0794415416798357
731,riennmu,wireless router,20.0,0,2,"Very good condition, by from challenge, work well and looks new",others,3.044522437723423,1.0986122886681098
732,dsstoresingapore,philips hr-1459 hand mixer,39.9,1,58,Philips HR-1459 Hand Mixer   300W Perfect dough and desserts in minutes 5 speeds plus turbo  Stainless steel strip beaters and dough hooks MODEL: HR-1459 SPECIFICATION  300W Perfect dough and desserts in minutes 5 speeds plus turbo  Stainless steel strip beaters and dough hooks Easy storage For a se,others,3.711130063048756,4.07753744390572
733,staywus,"mini fridge suitable for rental, dormitories usage",130.0,1,33,"Mini Fridge suitable for all Save electricity Pm us to order now - Preorder only.   Do note that: Due to covid measures, We dont do meet up for collection. Also, we will be using our courier delivery due to our policy with the courier company which has to comply. Thank you.   Kindly read the descrip",others,4.875197323201151,3.5263605246161616
734,valuepcshop,core i3 gen1 cpu lenovo a85 sff: cheap desktop,100.0,0,8,Full HDD Sector Scanned! Replaced new CMOS battery!  Model: Lenove A85 SFF - Core I3-550 @ 3.2Ghz - 4GB RAM/ 250GB HDD/ Intel HD Graphic/ Win 7 Pro - 2 Months Hardware Warranty (Not software. Exclude accidental drop/spill) - Available Qty: 2 units  [How to Purchase?] - You are welcome to browse our ,computers/parts,4.61512051684126,2.1972245773362196
735,hypebieu,apple airpods 2,70.0,1,14,Audio,audio_visual,4.2626798770413155,2.70805020110221
736,whose,ducky one 2 mini used for 1 year silent red switches,85.0,0,7,If meet up only after circuit breaker no box,cables/adapters/switches,4.454347296253507,2.0794415416798357
737,10ve_slams,hp deskjet printer,15.0,0,4,"Hp Deskjet 2130  Working condition, rarely used   Need replace catridge  Interested pm",printers,2.772588722239781,1.6094379124341003
738,itz.seannn_,samsung soundbar,170.0,1,36,samsung soundbar bnib no nego,audio_visual,5.14166355650266,3.6109179126442243
739,safetyfirst.sg,sensity phone steriliser box,0.08,1,9,"Safetyfirst.sg Steriliser Personal Accessories Box   ✅ Kills bacteria and germs in seconds ✅ Eliminates dangerous micro dirt particles ✅ Medical grade UV light ✅ Suitable for sanitizing all surfaces ✅ Chemical-free ✅ No refills needed ✅ USB rechargeable ✅ Long battery life ✅ Small, foldable design ✅",tablets/phones,0.07696104113612832,2.302585092994046
740,safetyfirst.sg,sensity uv sterilizer light,0.01,1,13,Our Sensity Pro Ultra-violet sterilizer is a pocket sized fit which helps to eliminate 99% of germs and viruses on the surface of most commonly used household and personal items.  ✅ Kills bacteria and germs in seconds ✅ Eliminates dangerous micro dirt particles ✅ Medical grade UV light ✅ Suitable fo,lights,0.009950330853168083,2.6390573296152584
741,alltronic,original  led tv's remote control for samsung smart 4k - bn5901259,20.0,1,10,"SMART LED 4K Remote control for Samsung  01259B/E UE40 / UN60 / UN55 series  Item in stock, only mailing service for now, Additional $5.00 (Reg mail Post)",remotes/batteries,3.044522437723423,2.3978952727983707
742,scott_od,sonos playbar - wireless soundbar + free wall mount bracket,750.0,0,1,"Sonos Playbar - Wireless Soundbar + free wall mount bracket   Excellent condition, looks like new  - Two-in-one. Adds full-theatre sound for your TV.   - Streams music, too.  - Simple two-cord setup. One for power. One for your TV.  - Works with your existing TV remote.  - Syncs wirelessly with SUB ",audio_visual,6.621405651764134,0.6931471805599453
743,valuepcshop,core2quad cpu lenovo a58: cheap desktop,90.0,0,5,Quad Core! 100% HDD Sectors Tested! New CMOS Battery.  Model: Lenovo A58 SFF - Core 2 Quad Q8400 @ 2.66Ghz  - DDR2 4GB RAM/ 250GB HDD/ Intel GMA 4500/ Win 7 Pro - 2 Months Hardware Warranty (Not software. Exclude accidental drop/spill) - Available Qty: 2 units  [How to Purchase?] - You are welcome t,computers/parts,4.51085950651685,1.791759469228055
744,gameoverboy2013,laptop ram ddr4 8gb ram. 2666mhz,38.0,0,11,Used. Upgraded to new one. So this one no use le,computers/parts,3.6635616461296463,2.4849066497880004
745,dave6273,dual 2x4 molex to 8 pin pci-e power cable,5.0,1,16,Brand New In Stock. Dual 2x4 Molex to 8 Pin PCI-E Power Cable  Compatible to all 8 pin graphic card.  Meet up point Sembawang MRT. By postage add SGD1 dollar.,cables/adapters/switches,1.791759469228055,2.833213344056216
746,alcatrazden,marantz integrated amplifier,350.0,0,6,picture description. feel free to ask if u are interested  Clearing at $300 (one set only),audio_visual,5.860786223465865,1.9459101490553132
747,toyotacamry,laptop ram ddr3 4gb,5.0,0,69,I got 6 pcs  Buy 1 for SGD5. take all 6 at SGD20  Deal at Parc Oasis Guard House,computers/parts,1.791759469228055,4.248495242049359
748,quekjane,"selling new crucial 2.5"" 240gb;480gb;1tb ssd.",67.0,1,39,"Selling New Crucial 2.5"" SSD With Local Disti Warranty.  1)240GB @$67.00  2)480GB @$115.00  3)1TB    @$189.00  Pls PM if keen to buy.Delivery charge @$12/trip.",others,4.219507705176107,3.6888794541139363
749,newchapters.,portable air oxygen pump usb for aquarium and fish tank business and home use,12.0,1,100,"Provide more oxygen and air to your fishes! Super easy and convenient to use! Ideal for business and home use! Create the bubble effect to make your aquarium look beautiful!  Customize your fish tank!  Elegant curve design, durable for use. High efficiency and extraordinary output. Silent Mute Energ",computers/parts,2.5649493574615367,4.61512051684126
750,newchapters.,"usb condenser microphone with stand and switch for gaming, podcast and video conference",16.0,1,99,"For PC, MAC and desktop! Ideal for video conference, school teaching and gaming! Want to be an aspiring YouTuber, or just having a great conversation online? Look no further then this microphone!  Product description Specifications Compatible with: Macbook/Desktop/Notebook/PC Microphone Directivity:",cables/adapters/switches,2.833213344056216,4.605170185988092
751,xtremesolution,kingston hyperx alloy origins core mechanical keyboard hyperx aqua switch,179.0,1,3,Kingston HyperX Alloy Origins Core Mechanical Keyboard (HyperX Aqua Switch)  For more information: https://www.hyperxgaming.com/us/keyboards/alloy-origins-core-tenkeyless-mechanical-gaming-keyboard?Switch=HyperX%20Aqua%20Switch  BNIB Sealed 1 Year Local warranty by Convergent Systems  Layout: Englis,cables/adapters/switches,5.19295685089021,1.3862943611198906
752,newchapters.,"headset microphone universal, portable and lightweight for presentations, teachings and conferences",10.0,1,101,"Ideal for video conference, school teaching and gaming! Want to be an aspiring YouTuber, or just having a great conversation online? Look no further then this microphone!  Features: Durable 1.18m nylon weaving wire, reliable for your normal using. Soft rubber tube frame, no pressure to your head. Su",audio_visual,2.3978952727983707,4.624972813284271
753,newchapters.,"telescope binoculars monocular 10x25 zoomable optic lens night vision bird watching, hiking, scenery, concert, nightview",12.0,1,78,"Use this telescope for your hobbies! -bird watching, hiking, concert, scenery!  Features: Easy to operate, very convenient. Supplied with strap, easy to carry. Supplied with cleaning cloth, keep lens clean. Adjustable focus length, you can rotate object or ocular lens according to your need. Ideal f",others,2.5649493574615367,4.3694478524670215
754,newchapters.,universal aircon a/c air conditioner cooling remote control,10.0,1,83,Can be used for almost all brands of Aircon! Very super easy and simple to use!  Control distance:Approx 8~10 meters Size: 13cm * 5cm * 1.5cm  Control distance: Approx 8~10 meters Power: 2 * AAA battery(not included) Introduction: Universal LCD A/C Muli Remote Control Controller for Aircon By using ,remotes/batteries,2.3978952727983707,4.430816798843313
755,newchapters.,aquarium fish tank water pump ideal for cleaning and changing water,9.0,1,68,"Clean your fish aquarium tank with ease! No mess! Ideal for home business use, personal or industrial!  Description: Brand New and high quality Easy-to-use cleaner pump for aquarium. Keeps the aquarium clean, gives your fish a nice living environment Keep your fish healthy Excellent helper to change",others,2.302585092994046,4.23410650459726
756,newchapters.,studio laptop desktop microphone on off button,12.0,1,73,Computer Parts & Accessories,audio_visual,2.5649493574615367,4.30406509320417
757,newchapters.,"3d glasses for games, tv, computer and laptop",8.0,1,70,"100% brand new and high quality. Use to view anaglyphic pictures, stereo 3D movies and play 3D games. Ideal for use to view 3D pictures, magazines, TV and much more. Offers a sense of reality.  Specifications: Item Type: 3D glasses Frame material: ABS+PC Lens material: PET Frame color: Black Lens Co",computers/parts,2.1972245773362196,4.2626798770413155
758,game.onz,gamemax vp-500 500w psu 80+ white vp500 component,55.0,1,12,"AUTHORISED DEALER, BRAND NEW IN BOX,  LOCAL WARRANTY 2 YEARS  http://www.gamemaxpc.com/product/showproduct.php?id=675  TAGS #GAMEMAX #POWER SUPPLY #POWER #PSU #POWER SUPPLY UNIT #80+ #WHITE #80+ WHITE",computers/parts,4.02535169073515,2.5649493574615367
759,vin2183,guitar gnx4,150.0,0,1,Rarely used relatively new,others,5.017279836814924,0.6931471805599453
760,fatboyauction9672,hubsan h501s standard edition - 1080p high definition camera - gps positioning - real time fpv - automatic return to home & follow me function,150.0,1,6,Brand: HUBSAN Drone Battery: 7.4V 2700mAh Li-Po Battery (included) Remote Control Battery: 7.4V 1300mAh rechargeable battery (included) Main Rotor Diameter: 7.3 inch (185mm) Fit Ages: 14+ Flight Time: 20 minutes Charging Time- 210 minutes Distance- 300 meters Frequency: 2.4GHz & 5.8GHz Memory card: ,audio_visual,5.017279836814924,1.9459101490553132
761,life8sgreat,digital tv hd setup box brand new,60.0,1,7,Brand new,audio_visual,4.110873864173311,2.0794415416798357
762,lg_samsung,"dell 22"" widescreen flat panel monitor",30.0,0,3,"Monitor in working condition, just detached from PC Model E228WFP  On/Off switch not working. Monitor will go into standby mode when PC is sleeping / switched off. Comes on when PC is switched on Not recommended for video watching  Please refer to the photos for the actual item and condition. DVI & ",audio_visual,3.4339872044851463,1.3862943611198906
763,isekai_maou.,hp desktop,280.0,0,45,"Selling hp desktop Come with 27 inch monitor, keyboard and mouse Intel core i5 760 Amd hd 5570 gpu 8gb ram Hdd 1tb Ssd 500gb Win 10 And yes it have Microsoft Office  Rfs: not really use it Fast deal pm me Able to nego",computers/parts,5.638354669333745,3.828641396489095
764,xtremesolution,ducky one 2 mini horizon mechanical keyboard white led only,159.0,1,55,"Ducky One 2 Mini Horizon Mechanical Keyboard (White LED only)  Available in Cherry MX Red, Blue, Brown, Speed and Silent Red switches  For more information: https://www.duckychannel.com.tw/en/Ducky-One2-Mini-Horizon  BNIB  1 Year Local Warranty by XtremeSolution Pte Ltd  Tags Ducky One 2 Mini Horizo",keyboards/mouse/chargers,5.075173815233827,4.02535169073515
