,Seller,Product,Price,Quality,Likes,Comments,Category,Log Price,Log Likes
1961,anderss,sandisk ultra microsdxc 200gb sdcard,60.0,1,4,SanDisk Ultra microSDXC UHS-1 Card with Adapter MicroSD Card 200GB  Authentic Set Speed up to 100MB/s  Newegg set.  #sandisk #samsung #adata #lexar #transcend #sony #pny #kingston #256GB #128GB #64GB #32GB #16GB #8GB #microSD #SD #sdcard #sdxc #sdhc #evo #evoplus,computers/parts,4.110873864173311,1.6094379124341003
1962,onlinehome,vintage style non-ticking silent antique wall clock gift,22.8,1,7,Material: wooden MDF + plastic domestic movement Color: picture color Size: 30*30cm Weight: 500g   Product list: 1* vintage wood wall clock   Description: The shipment does not have a battery and requires a 5th battery.   Features: 1. Decorate your home with this wall clock. Perfect for living room ,time,3.169685580677429,2.0794415416798357
1963,brian95haha,rgb cooler master devastator 3 plus gaming keyboard + mouse,40.0,0,5,Mem-Chanical Gaming Keyboard and Mouse combo with 7 brilliant colours RGB + RGB Mouse  Cherry Keycap   Condition 9.9/10 Use it for less then a week. Wire and USB port is still clear with no rust.  Packaging and mouse are included,keyboards/mouse/chargers,3.713572066704308,1.791759469228055
1964,jerseysshop,authentic macbook pro 60w magsafe charger,45.0,1,4,Authentic. Brand New Without Box. Details stated on the images.,keyboards/mouse/chargers,3.828641396489095,1.6094379124341003
1965,e-shoponline674,"2.5, 3.5 harddisk",15.0,0,6,Price of hard disk   2.5 fujitsu 120gb - $15 2.5 western digital 120gb - $15 2.5 Seagate 160gb - $18 2.5 Seagate 320gb - $25 2.5 Hitachi 500gb - $30 2.5 Seagate 500gb - $30   3.5 Deskstar 80gb - $3 3.5 Hitachi 160gb - $15 3.5 Hitachi 500gb - $30 3.5 Seagate 160gb - $15 3.5 Seagate. 2TB - $100,others,2.772588722239781,1.9459101490553132
1966,kjloo,razer kraken pro v2,40.0,0,2,selling fast NEW EAR CUSHIONS pls take note of the condition in 2nd and 3rd pic 100% working condition,others,3.713572066704308,1.0986122886681098
1967,teh12345,apple tv 4th gen 32gb with warranty,188.0,1,2,Apple certified refurbished. 1 year apple warranty till May 2021  Shrink wrapped from apple,audio_visual,5.241747015059643,1.0986122886681098
1968,lightscent,▫️22 hk1 box with i8 wireless keyboard amlogic s905x3 smart android 9.0 tv box 4gb ram 32gb rom 2.4g 5g wifi bluetooth 4k uhd,99.0,1,8,"HK1 SMART ANDROID TV BOX  🔥 PROMO 🔥 - LIMITED TIME DEAL!! GET FREE i8 WIRELESS KEYBOARD WHEN PURCHASE(Refer to last pic)  Stock : 4
 
 Features 
 
 [ S905X3 ]     The latest most powerful chip
 [ Android 9.0 ]  Easy access to all kinds of apps and video resources, more stable than android 6.0/7.1/8.",audio_visual,4.605170185988092,2.1972245773362196
1969,chongjoonhau,laptop hdd 1tb,45.0,0,11,Wts laptop hdd 1tb in mint condition,computers/parts,3.828641396489095,2.4849066497880004
1970,akisuri,corsair k70 lux rgb - brown switch,90.0,0,5,Corsair K70 LUX RGB mechanical keyboard Cherry MX Brown switches  Physical Condition: 8/10 - Left and right feet rubber broken off (pic 3 & 4) - Scuffs near top left and right of back of keyboard (pic 5 & 6) - Right Ctrl keycap stem broken (pic 7) - Scratches on bottom left of keyboard (pic 8)  All ,cables/adapters/switches,4.51085950651685,1.791759469228055
1971,joseph4797,amplifier,200.0,0,2,sony integrated stereo amplifier model:TA-F45 Full working condition only left side speaker have humming Phono Tuner Aux or working condition mm/mc can use,audio_visual,5.303304908059076,1.0986122886681098
1972,luxebuys,brother sewing machine bm-2600,180.0,0,7,Bought this sewing machine and used it just few time.,printers,5.198497031265826,2.0794415416798357
1973,rabsgstore,ap-02 guitar pedal power supply guitar accessories 8 dc outputs for 9v / 12v / 18v effect pedal power station cards box sg plug,28.0,1,17,"F513  This universal power pedal supplu probides 8 negative center barrel taken with a total power of 2000mA. Sockets of A and B are switchable to 9, 12 or 18 volts to power effects that require higher DC cuttents or 9 volt pedals which can be operated on 12 or 18 volts for the most dynamic and head",cables/adapters/switches,3.367295829986474,2.8903717578961645
1974,kreative.electronics888,ab210 micro guitar 5w amplifier,30.0,1,2,"Features:  5W power amplifier.  Excellent performance & elegant design.  Adopts high-sensitivity dedicated guitar speaker.  Sound is clear and clean, with excellent sound effects.  Equiped with the volume & the tone controlling functions.  With an input port and a headphone port.  Compact, reliable ",audio_visual,3.4339872044851463,1.0986122886681098
1975,mansacomputers,asus gtx 1660 6 gb phoenix,250.0,1,96,Brand new in box. Comes with 3 years warranty.,computers/parts,5.5254529391317835,4.574710978503383
1976,loh.dorothy,qnap ts-869 pro,750.0,0,14,- 8 bay tower TurboNAS - CPU 2.13G dual core - memory 1G RAM  - HDD not included  - available 5x 2TB SATA HDD @$80 each,others,6.621405651764134,2.70805020110221
1977,tadonalizambrose,sewing machine for sale.80.good condition.hp 81208559,80.0,0,3,sewing machine for sale.$80.good condition.hp 81208559,others,4.394449154672439,1.3862943611198906
1978,acc3ssori3s,jbl flip 5 portable waterproof speaker local sealed set with warranty,115.0,1,15,BNIB Sealed with one year SG warranty by JBL receipt will be provided  Price is firm  Color : Blue / Black !  Sounds better than ever Bring the party anywhere Make a splash with IPX7 waterproof design Crank up the fun with PartyBoost A rainbow of colours Tough as it sounds,audio_visual,4.7535901911063645,2.772588722239781
1979,amorezel,"record player, portable mini suitcase turntable for 7 inch vinyl record, belt-drive 2-speed turntable with built in stereo speaker blue",30.0,1,7,Mini & Cute Turntable  Portable Mini Record Player --The Smallest Suitcase Turntable in the World  About Music Public Kingdom  Our record player is a perfect combo of trendy elements and retro style with classical color series. With rich experience of 20 years in turntable industry. Our record playe,audio_visual,3.4339872044851463,2.0794415416798357
1980,homemade.with.love,thermomix tm5  we accept instalment plan by credit card,1500.0,0,102,"$1500 negotiable   We accept instalment plan by credit card  95% conditions is like brand new set  I have 2 thermomix for sell  Both are TM5 - Original price $2320 Use few time  WhatsApp me if you are keen  Pls don’t pm me due to rarely online   Complete come with Basic Cookbook & Cook chip, TM acce",computers/parts,7.313886831633462,4.634728988229636
1981,hotcpu,lenovo laptop for sell 100,100.0,0,41,Sell Lenovo ThinkPad laptop Can used for office  Homework  Youtube   Win 7 os Cpu: T8100 core 2.    2.1GHZ Ram:2GB HDD:120 GB 14 inch Monitor  Win7 os With charger  Let me know if you want  Thanks . ,computers/parts,4.61512051684126,3.7376696182833684
1982,kessfoo,airpod box only original,2.0,1,1,Box only  Additional for postage,audio_visual,1.0986122886681098,0.6931471805599453
1983,ong7710,taotronics soundsurge 60,33.0,1,5,Audio,others,3.5263605246161616,1.791759469228055
1984,ptm108,ryzen 5 1600 af,170.0,0,14,"Selling an Ryzen 5 1600 AF. Used for less than a month, recently upgraded. Comes with box, manual, CPU cooler. 6 cores 12 threads, sufficient for most workloads.  Do note this is the AF version (check the serial number on box). Similar performance and architecture to the Ryzen 5 2600. Google for mor",computers/parts,5.14166355650266,2.70805020110221
1985,rabsgstore,ammoon 61 key roll up piano electronic keyboard portable silicon built-in stereo speaker 1000ma li-ion battery support midi out microphone audio input functions 61-key,50.0,1,7,"G6x2  Portable 61 keys roll up piano with LED display, silicon material, comfortable to play and convenient to carry. 128 kinds of tone that can be chose by numbers keys, plus 128 kinds of rhythms and 14 demo songs, various choices for you. Built-in speaker, you can enjoy the music freely; with 3.5m",audio_visual,3.9318256327243257,2.0794415416798357
1986,supersgsell,"led strip lights, hrdj light strip rgb 32.8ft/10m 20key, music sync color changing, rope light 600 smd 3528 led, ir remote controller flexible strip for home party bedroom diy party indoor 2x5m",50.0,1,6,"** Colourful LED lights , can control to have 3 colours at the same time  ♛【Amazing Dancing HRDJ Light】With a high keen mic, this light strip can listen and dance to surrounding music. You will see it flashing and changing color with beats! If you love music, this is a must try decoration for you.  ",remotes/batteries,3.9318256327243257,1.9459101490553132
1987,game.onz,gamemax gamma 300 rainbow cpu cooler hsf heat sink top flow intel amd compatible lga 115x 1366 775 am4 am3 component,40.0,1,10,"AUTHORISED DEALER, BRAND NEW, LOCAL WARRANTY  http://www.gamemaxpc.com/productkkk/showproduct.php?id=939  Gamma 300 Rainbow Gamma 300 CPU air cooler provides excellent performance featuring a 120mm big bowl fan for higher air pressure, and unique top-down Accelerated Cooling design to dissipate heat",computers/parts,3.713572066704308,2.3978952727983707
1988,trivalc,xiaomi smartmi fan with built-in battery smart app controls and oscillation mode / xiaomi smartmi pedestal fan / xiaomi fan / xiaomi,129.0,1,16,"Refer to this video for more information:  https://youtu.be/MsjPNjAIrKs  Main Features: • Simulates Comfortable Natural Wind • Quiet Operation less than 31.5dB • Lightweight and Portable • 100 Stepless Speeds • Smart APP Controls • 2800mAh Lithium-ion Battery, up to 20 hours of refreshing breezes  T",air,4.867534450455582,2.833213344056216
1989,tech22,👍2020 new svicloud android tv box,148.0,1,52,⭐3 DAYS RISK FREE RETURN IF YOU ARE NOT SATISFIED WITH QUALITY OF TV BOX BUT YOU HAVE TO PACK IT BACK NICELY INTO THE BOX.  ⭐EASY INTERFACE FOR ELDERLY  ⭐1000+ LIVE CHANNELS   ⭐10000+ VODs   ⭐LIVE 🥊🏀⚽️  ⭐LOCAL VERSION WITH MALAYSIA LIVE AND MALAYSIA VOD   ⭐1 YEAR OFFICIAL WARRANTY WITH WARRANTY CARD,audio_visual,5.003946305945459,3.970291913552122
1990,fossil.hub,free delivery & promotion marshall major ii on-ear headphones with mic headset,79.2,1,229,"Marshall Major II On-Ear Headphones with Mic Headset  ** IMMEDIATE STOCK, no need to pre-order. While stocks last! **  💯 ASSURED with your purchase. Legit seller with 50+ positive feedbacks and proven sales   👍 WIRED headphones, Item is brand new, original and authentic straight from Marshall Distri",audio_visual,4.384523514872469,5.438079308923196
1991,rabsgstore,torch clip mount bicycle front light bracket flashlight holder 360°rotation black,3.0,1,11,Material: High quality Aluminium Hold the flashlight or torch on your bicycle With antiskid rubber gaskets to protect your handlebar from wear and tear Suitable for the diameter of flashlight 1.6-3.6cm Suitable for the diameter of handlebar about 1.6 x 2.8 cm  High quality rubber with metal screws E,lights,1.3862943611198906,2.4849066497880004
1992,yharnamite,mini itx gaming pc,1.0,0,29,"I’m leaving SGP so hope to sell fast Spec: https://valid.x86.fr/xt8nck Please offer. Do note with or without monitor. Note:  Monitor with built in speaker. i7 7700k delidded so it runs pretty cool, paired with Cryorig C7 hs. Asus ROG Strix 1080Ti OC. 2 SSD (1TB+256Gig) + 1TB HDD. Chassis is silver s",computers/parts,0.6931471805599453,3.4011973816621555
1993,bubblycheska,philips micro music system btd1180,100.0,0,20,"Philips Micro Sound System  Lightly used in Good Condition Comes with Original box. Self collect at Serangoon North Ave 4  Sound that fits your home Listen to all your digital music from your Smartphone via Bluetooth®. The Philips sound system also plays DVDs, DivX titles, CDs and MP3-CDs. Enjoy you",others,4.61512051684126,3.044522437723423
1994,williamshz,emotiva : basx -a150 stereo power amplifier,395.0,1,23,New set. Played once or twice for testing. Perfect condition. No scratches no dust.,audio_visual,5.981414211254481,3.1780538303479458
1995,diine,1441 fugen 60w ac adapter charger for apple macbook air a1184/a1330/a1344/retina a1435/a1435/a1502/a1425 white,18.0,1,2,Brand new with box  What you see is what you will get  FUGEN 60W AC Adapter Charger for Apple Macbook Air A1184/A1330/A1344/Retina A1435/A1435/A1502/A1425 (White)  Description  It's a 60w adapter that will provide efficient power to your laptop over extended periods of time without heating up.  Feat,keyboards/mouse/chargers,2.9444389791664403,1.0986122886681098
1996,genjism,high pressure car washing machine,30.0,1,32,Brand new complete set with hose Can nego  #cars #motor #washing #cleaning #new,others,3.4339872044851463,3.4965075614664802
1997,hazgo,sennheiser momentum true wireless bluetooth earbuds,199.0,0,20,Sennheiser MOMENTUM True Wireless Bluetooth Earbuds with Fingertip Touch Control Bought in 2019. Didn't use much.  Letting go cos using Samsung Earbuds with Samsung phone.  Price non nego. Will not reply to nego n trade. Delivery not included.,audio_visual,5.298317366548036,3.044522437723423
1998,dc_auctions,"brunt blind engine - smart motorized blind, make your existing blind to smart, automated, motorized blind, connected home, home automation, compatible with amazon alexa and google assistant",79.9,1,9,Brand new  https://www.brunt.co/us/goods/goods_view.php?goodsNo=1000000014  https://www.amazon.co.uk/Brunt-Blind-Engine-Automation-Compatible/dp/B0797W31BQ  About this item  💯 【CONNECTED WITH SMARTPHONE】 : Motorize your own blind and control on your smart devices.  🎁 【MOBILE CONTROL】 : Raise and low,others,4.393213824064446,2.302585092994046
1999,stylelifeenterprise1,type c to vga adapter male to vga female converter adapter for macbook,10.0,1,3,Feature  Standard USB3.1 Type-C  Supports USB 3.1 input and VGA output  Flexible USB Type-C Switching Support for USB 5G and DisplayPort 1.2 Alt mode  Supports VGA 225 MHz / 2.25 Gbps per channel (6.75Gbps all channel) bandwidth  Supports DVI 12 bit per channel (36 bit all channel) deep color  Suppo,cables/adapters/switches,2.3978952727983707,1.3862943611198906
2000,joseph_lim_cs,casement aircon europace eac 393,340.0,0,28,Good news for those having Europace Casement aircon!! And my existing Europace  Casement aircon Customer  1. NEW CUSTOMERS  If your Europace Casement aircon not working or Spoiled you can trade in yours or change one unit to  Model EAC393 Europace Casement aircon.   It come with removing your Spoile,air,5.831882477283517,3.367295829986474
2001,confirm_value_for_money,🆕apple airpods 2nd gem wire charging case sealed,179.0,1,10,"Description  ✅Your attitude reflects My attitude ✅Fixed price ✅Fixed pick up location at Blk 801 yishun ring road S760801 ✅No entertain to bargain, no deal if cannot accept “fixed price, fixed location” ✅No entertain to photo request, if insist to see sealed box photo, kindly contact manufacturer. ✅",keyboards/mouse/chargers,5.19295685089021,2.3978952727983707
2002,m_ouse,yamaha wx-030,140.0,0,18,Price negotiable Still in excellent condition Use inside room only,others,4.948759890378168,2.9444389791664403
2003,acerasus,"lapbook pro 14"" chuwi laptop hinge issue",199.0,0,10,"READ DESCRIPTION AND SPECS
 
 Intel n4100 cpu / 8 gb ddr4 ram / 256gb ssd / UHD 600 graphics / 14.1 inch IPS FHD screen / windows 10 home / 4900 mah battery / 6 months old
 
 metal bracket of hinge and brass inset came off (see pics), repairs will cost around $80 - 100 (will give you contact)
 wifi ",computers/parts,5.298317366548036,2.3978952727983707
2004,justclearingstuff2020,convertor hdmi vga usb-c,16.0,1,6,bought it but couldnt use/test for my mac as my mac is macbook air instead of macbook pro. New.,others,2.833213344056216,1.9459101490553132
2005,premium.affordable,smart alarm clock/temperature/micro light sensor aq138 black,12.0,1,2,"•	ED backlight at night  •	Micro-Light Sensor: When the luminance of room is lower than 15lux (approx.), the light sensor will trigger the micro-light on   •	Beep Alarm with snooze function and 2-range loudness switchable  •	Available in Pearl White and Pure Black  ",lights,2.5649493574615367,1.0986122886681098
2006,buy_stuf4280,gaming pc,800.0,0,1,Desktops,computers/parts,6.68586094706836,0.6931471805599453
2007,mrcasteels,gt 1030,60.0,0,1,"used GT 1030 works perfectly, great for gaming and work, will provide delivery free of charge if match price",others,4.110873864173311,0.6931471805599453
2008,rodneyboey,turntable with speakers vintage phonograph record player stereo sound,48.0,1,3,"PU leather wooden box, fashionable design, simple and generous. Three speed, compatible with most of the records on the market. Ruby needle for accurate pickup. Easy to operate and play music conveniently. Built-in speakers and tone arm with soft damping control add to its exquisiteness. Compatible",audio_visual,3.8918202981106265,1.3862943611198906
2009,bleath,zotac gtx 1070 ti,350.0,0,59,Used gtx 1070 ti but in good working condition.selling cause I want to upgrade to a better gpu. 1070 ti is equivalent to rtx 2060.,computers/parts,5.860786223465865,4.0943445622221
2010,honduras_,samsung 27' curved monitor,200.0,0,19,"Samsung Curved 27' Monitor  1920x1080 Full HD  60Hz refresh rate   After buying rarely used as I also bought a laptop.  In tip-top condition.   Great for WFH or school use as it is large and clear, with deep blacks as usual for a Samsung Panel, same as their smartphone",audio_visual,5.303304908059076,2.995732273553991
2011,jarylchan,magicforce 68 key mechanical keyboard,55.0,1,3,"New Magicforce 68 silver edition still in box and plastic wrapping  Uses Kailh red switches  Blue backlighting with orange leds for wasd and arrow keys   Price is fixed, please do not lowball Lowballers will be ignored Do not ask me for best/lowest price, price is FIXED           Tags: magicforce 68",keyboards/mouse/chargers,4.02535169073515,1.3862943611198906
2012,yangsellers,lenovo yogabook,519.0,0,1,"Well-kept device Used for roughly a year Runs on ssd Everything included, power adaptor, stylus pen etc Physical condition: 9/10 Small and convenient Feel free to dm me😄",others,6.253828811575473,0.6931471805599453
2013,ninjaelegy,vortex vibe keyboard mx brown,120.0,0,11,Selling lightly used Vortex Vibe Keyboard with Cherry MX Brown switches. Bought them a few months ago but decided to switch to different type of keyboard.  Comes with original packaging and included extra keycaps.  Deal in Tampines on weekends and Chinatown on weekdays. ,keyboards/mouse/chargers,4.795790545596741,2.4849066497880004
2014,redzapple,2018 new akaso ek7000 4k sports action camera wifi waterproof dvr camcorder 12mp,79.0,1,16,"Professional Video Quality AKASO EK7000 features ultra HD 4K video recording. You can capture stunning 4K 25fps/2.7K 30fps/1080P 60fps video which is sharper and more lifelike than ever. High-resolution, high frame rate 4K 25fps and 2.7K 30fps video deliver distinctly smooth video.  Fast, Powerful P",audio_visual,4.382026634673881,2.833213344056216
2015,jacrpl,500gb hard disk,15.0,0,17,"Sell off extra hard disk (500GB) X 2 Both for $15 Price firm, only sincere buyer Both are empty disk. PM me if you need Windows OS to be installed.",computers/parts,2.772588722239781,2.8903717578961645
2016,lav885,dell optiplex 9010,350.0,0,13,"Dell Optiplex 9010, Intel i5, 16gb Ram, 250gb SSD and 1TB hdd, fast and powerful. Windows 10 Pro w/ Microsoft Office",computers/parts,5.860786223465865,2.6390573296152584
2017,tengkai87,ipad pro 11” 2018 256 gb wifi + cellular,1400.0,0,10,"Selling iPad Pro 11” 2018, 256 GB with wifi+ cellular. Good condition as barely used, been using macbook more.   Selling with Apple Pencil 2.",tablets/phones,7.244941546337007,2.3978952727983707
2018,eroundshop,"new philips micro music system btm2310/12 with bluetooth cd, mp3-cd, usb, fm usb port for charging",216.9,1,4,"FREE DELIVERY  Relax to great music Obsessed with sound Listen to your smartphone tunes, stream your music library over Bluetooth and play MP3- CDs on this compact, all-in-one Philips music system. Charge all your smart devices, from smartphones to tablets with the built-in USB charging port. Enrich",keyboards/mouse/chargers,5.384036241950574,1.6094379124341003
2019,chyen01,laconic lab night blues mini headphone amp,450.0,0,18,"Unobtainium amp from Russia which is extremely difficult to import to SG due to strict export policy from Russia.  I paid a few times of shipping arrangement + duty just to bring this here and was not disappointed.   Highly praised on SBAF, a very solid performer at its price range. Pairs really wel",audio_visual,6.111467339502679,2.9444389791664403
2020,dc_auctions,"dodocool ,2018 new technology- steamer for clothes-180ml, 5-in-1 steamer clothes,garment steamer,fabric steamer,travel steamer,handheld steamer wrinkle remover automatic shut-off safety protection",17.9,1,2,"Brand new  About this item [Baffle Design To Protect Your Hand and Clothes Safe]- dodocool personal steamer for clothes adopts the advanced technology, special baffle design to prevent mist liquefaction and boiling water sprayed.This steamer will automatically cut power off when the unit overheats o",others,2.9391619220655967,1.0986122886681098
2021,keykaboo,star trek beyond mousepad,15.0,1,20,"Brand new 30x80cm mouspad  Good for gaming and working !! (Quality similar to Razer ,however it's much bigger in size ) Enhance the look your gaming /working environment!🙆🙆    Magicforce,razer,ajazz,blackwidow,switch,blue,black,red,brown,RGB,mechanical,keyboard,gaming,pbt,abs,corsair,steelseries,qui",others,2.772588722239781,3.044522437723423
2022,tzl2611,toshiba 500gb hard disk freshly formatted,15.0,0,9,Selling a Toshiba 500gb hard disk for only $15 ! In very good condition 👍  Does comes with the sata connector in case you do not have one !   Chat with me if interested 😉,computers/parts,2.772588722239781,2.302585092994046
2023,daigua,incase macbook air 13 retina 2018,35.0,1,3,"Original incase for MacBook Air 13, 2018 model. Blue color and cloth texture",computers/parts,3.58351893845611,1.3862943611198906
2024,lazydog226,laptop stand for any size,17.0,1,4,"Ergonomic design help you put the laptop or notebook screen to eye level at 5different height settings to fit your preferred viewing angle, correct your posture, so as to prevent the incurable spinal cord injury. High-quality rust-proof aluminum alloy presents excellent product look, scratch-resista",computers/parts,2.8903717578961645,1.6094379124341003
2025,sharelink_click,adjustable foldable aluminum laptop stand non-slip desktop notebook holder laptop stand qoo10,11.9,1,7,"I don't own it, sharing item only.                             ↓Click↓ https://qoo.tn/BnC8tW/Q146549380 Sold by MIAOJIANG. To Coupon $10  :  https://sg.carousell.com/p/287554139",computers/parts,2.5572273113676265,2.0794415416798357
2026,olahomesingapore,vacuum sealing machine,65.0,1,4,"🏪🛍️👪 OM Outlet - Your Preferred Lifestyle Store  🆓🚗 FREE DELIVERY!  🤩💫 MOST affordable prices! 💫🤩  Thank you for visiting our store! 🙏🙏 📲 For our complete list of products, please check out our main page: https://sg.carousell.com/olahomesingapore/  Vacuum sealing machine helps you seal and preserve ",others,4.189654742026425,1.6094379124341003
2027,xtremesolution,logitech g pro wireless - pink - pre - order,349.0,1,3,Pre-order now. Estimate arrival Mid Jun.  ,keyboards/mouse/chargers,5.857933154483459,1.3862943611198906
2028,cctvbros_wilson,samsung sound bar hw-h751,200.0,0,5,Samsung sound bar for sales,audio_visual,5.303304908059076,1.791759469228055
2029,honestselling276,bluetooth yamaha amplifier free book onkyo denon speakers soundbar home theatre systems,158.0,0,7,"works 10/10. No remote. Testing provided.Play using bluetooth add $28. https://www.hifiengine.com/manual_library/yamaha/ax-396.shtml  Clearing!!!   go to  carousell.com/honest276 or my friend carousell.com/honestselling276 .Many items clearing, more Bowers & Wilkins ,Quad,Yamaha, Denon, Nad ,monitor",audio_visual,5.0689042022202315,2.0794415416798357
2030,ffaithh,13 macbook pro 256gb,879.0,0,55,Selling MacBook Pro 13 inch 256GB in absolutely pristine condition as shown in the photos.     Screen protector attached since day one  Screen has absolutely no scratches  Keyboard is fresh & free of dirt & dust  Mac is never used without keyboard protector (will be included in your purchase of this,computers/parts,6.779921907472252,4.02535169073515
2031,kk1985,hyperx cloud alpha,120.0,0,1,Bought the wrong model by mistake. One day old. ,others,4.795790545596741,0.6931471805599453
2032,skylelong,"jellas orbital sander, 280w 125mm sander machine with 13000rpm 6 variable speed, dust collection bag, 360°rotating sanding base plate, 3meter power cord random orbit sander",71.0,1,9,"▶【Powerful Operating System】The wood sander machine is 280W for high power demands, the maximum power can reach to 300W. Its premium pure copper motor works up to 13000 rpm. Good heat resistance and good cooling system prevent burn-in due to overheating when use for a long time. ▶【360° Rotating Base",cables/adapters/switches,4.276666119016055,2.302585092994046
2033,glay78,apple iie with colour monitor,2999.0,0,29,Original 1983 Apple IIe set for sale.  Comes with  Apple IIe upgraded 128k memory AppleColor Composite Monitor IIe 2 x 5.25” Disk Drive Joystick  Some games in disk Floppy disk emulator (allows copy of games downloaded from internet to run on SD Card)  Fully working set.   Top up $200 for a monochro,audio_visual,8.006367567650246,3.4011973816621555
2034,ravenblake,beats solo3 wireless,100.0,0,11,rose gold  retail price $279  selling it away as i haven’t been utilising it :(  very good condition.  comes with the carrying case. ,audio_visual,4.61512051684126,2.4849066497880004
